ID	Target	Tweet	Stance	Origin	Total	Origin_ID
1	qanon	WARNING RT QAnon 8Chan and TheGreatAwakening There may be a FalseFlag set up on the Q Research boards Apparently an Anon wants to 	AGAINST	"WARNING-RT #QAnon #8Chan and #TheGreatAwakening: There may be a # FalseFlag 🤡 ""set up"" on the Q Research boards. Apparently an #Anon wants to ..."	10	0_google_1
2	qanon	WARNING RT QAnon 8Chan and TheGreatAwakening There may be a FalseFlag POTUS 8chan PatriotsFight BuildTheWallNow Winning InternetBillOfRights I_m Voting With My Middle Finger This Time In case anyone was wondering whether or not Trump is winning and taking down 	AGAINST	WARNING-RT #QAnon #8Chan and #TheGreatAwakening: There may be a # FalseFlag 🤡 .... #POTUS #8chan #PatriotsFight #BuildTheWallNow #Winning # InternetBillOfRights ... @POTUS: I'm Voting With My Middle Finger This Time: ... In  case anyone was wondering whether or not Trump is winning and taking down ...	10	0_google_2
3	qanon	limit my search to r greatawakening Welcome to the Great Awakening With rhetorical questions suggestions and clues Q Qanon is allowing us to glimpse beyond the world scenes The Calm Before The Storm TweetPOTUS RAPID FIRE TWEET ATTACK Roseanne fighting the good fight with her platform 	AGAINST	limit my search to r/greatawakening ... Welcome to the Great Awakening. With  rhetorical questions, suggestions and clues Q (Qanon), is allowing us to glimpse  beyond the world scenes. ... The Calm Before The Storm. ... TweetPOTUS RAPID  FIRE TWEET ATTACK!! .... Roseanne, fighting the good fight with her platform.	10	0_google_3
4	qanon	Thunder_ShockThe Great Awakening It_s the new Q board on 8chan Do not let anything or anyone back us down WWG1WGA He is giving all of us ownership and credit for this fight Patriot_s on my thread so you understand and gain the victory in your own lives The Calm Before The Storm 	NONE	Thunder_ShockThe Great Awakening. ... It's the new Q board on 8chan. .... Do  not let anything or anyone back us down - WWG1WGA!!! .... He is giving all of us  ownership and credit for this fight - Patriot's ... on my thread so you understand  and gain the victory in your own lives. .... The Calm Before The Storm.	10	0_google_4
5	qanon	Dec 19 2017 Like Pizzagate the Storm conspiracy features secret cabals a child to 4chan in order to covertly inform the public about POTUS_s master Q Clearance Patriot back our great country the land of the free from the evil tyrants that the Storm has spread from the depths of 4chan and 8chan to Reddit 	FAVOR	Dec 19, 2017 ... Like Pizzagate, the Storm conspiracy features secret cabals, a child ... to 4chan in  order to covertly inform the public about POTUS's master ... Q Clearance Patriot ...  back our great country (the land of the free) from the evil tyrants that ... the Storm  has spread from the depths of 4chan and 8chan to Reddit, ...	10	0_google_5
6	qanon	Husband 31 yrs Father of 3 WWG1WGA Trump2018 GreatAwakening InternetBillOfRights InternetBillOfRightsNow ClownsInAmerica DeepState 	AGAINST	Husband 31 yrs,Father of 3, #WWG1WGA #Trump2018. ... #GreatAwakening # InternetBillOfRights #InternetBillOfRightsNow #ClownsInAmerica #DeepState ...	10	0_google_6
7	qanon	TheStorm QAnon GreatAwakening WeThePeople USA WWG1WGA KAG MAGA QAnon FakeNews InternetBillOfRights winning We must support what our great is doing for realDonaldTrump we need PATRIOTSUNITE fight this battle WAR for the children 	FAVOR	#TheStorm #QAnon #GreatAwakening #WeThePeople #USA #WWG1WGA ... # KAG @POTUS #MAGA #QAnon #FakeNews #InternetBillOfRights #winning ...  We must support what our great @POTUS @realDonaldTrump is doing for ... @ realDonaldTrump we need #PATRIOTSUNITE fight this battle/WAR for the  children!	10	0_google_7
8	qanon	Sounds like a great plan besides we don_t want them More Winning DrainTheDeepStateSwamp WeThePeople GreatAwakening QAnon Because Rosenstein is Investigating POTUS who appointed him to his DOJ InternetBillOfRights GreatAwakening 	AGAINST	@libtardsRScum Sounds like a great plan, besides we don't want them ... More  Winning!!! ... #DrainTheDeepStateSwamp #WeThePeople #GreatAwakening # QAnon ... Because Rosenstein is Investigating POTUS who appointed him to his  DOJ ... #InternetBillOfRights #GreatAwakening twitter.com/LaunchHashtags/sta.	10	0_google_8
9	qanon	wwg1wga 7 3 greatawakening good concept we_ll see what QAnon does all see something on 8chan or Qanon pub saying something about death by All patriots plz be careful Strategy without tactics is the longest road to victory 	FAVOR	"#wwg1wga. 7.3%. #greatawakening .... @dadthebonedoc good concept- we'll  see what #QAnon does. ... all see something on 8chan or Qanon.pub saying  something about ""death by ... @dadthebonedoc @SherriDeford All patriots, plz  be careful. ..... @stevenmcnerney_ Strategy without tactics is the longest road to  victory."	10	0_google_9
10	qanon		NONE		10	0_google_10
11	qanon	Once you know your whole world will change forever join the movement QAnon MAGA Trump GreatAwakening WednesdayWisdom QanonPosts 	FAVOR	Once you know your whole world will change forever... join the movement # QAnon #MAGA #Trump #GreatAwakening #WednesdayWisdom #QanonPosts ...	6	1_google_1
12	qanon	MAGA QAnon GreatAwakening TheStorm POTUS 8chan PatriotsFight BuildTheWallNow Winning InternetBillOfRights TuesdayThoughts 	AGAINST	#MAGA #QAnon #GreatAwakening #TheStorm #POTUS #8chan #PatriotsFight # BuildTheWallNow #Winning #InternetBillOfRights #TuesdayThoughts.	6	1_google_2
13	qanon	QAnon WWG1WGA InternetBillOfRights OIGReport PatriotsFight NRA PRO2A MolonLabe MAGA KAG FireMueller ReleaseEverything BackTheBlue MAGA QAnon GreatAwakening TheStorm POTUS 8chan PatriotsFight BuildTheWallNow Winning InternetBillOfRights TuesdayThoughts 	AGAINST	#QAnon #WWG1WGA #InternetBillOfRights #OIGReport #PatriotsFight #NRA # PRO2A #MolonLabe #MAGA #KAG #FireMueller #ReleaseEverything # BackTheBlue ... #MAGA #QAnon #GreatAwakening #TheStorm #POTUS #8chan  #PatriotsFight #BuildTheWallNow #Winning #InternetBillOfRights # TuesdayThoughts.	6	1_google_3
14	qanon	MAGA QAnon GreatAwakening TheStorm POTUS 8chan PatriotsFight BuildTheWallNow Winning InternetBillOfRights TuesdayThoughts 	AGAINST	#MAGA #QAnon #GreatAwakening #TheStorm #POTUS #8chan #PatriotsFight # BuildTheWallNow #Winning #InternetBillOfRights #TuesdayThoughts.	6	1_google_4
15	qanon	May 11 2018 r greatawakening The long and secret info wars against Q and how he to convince Q is not real he_s a bot or a hired human LARPING on 8Chan Our journey into The Storm An interview with Dr Jerome Corsi QAnon TheStorm Still Report therebel media Trump Wins Whistleblowers Wikileaks 	AGAINST	"May 11, 2018 ... r/greatawakening – The long and secret info wars against Q and how he .... to  convince Q is not real, he's a bot or a hired human LARPING on 8Chan. .... Our  journey into ""The Storm"": An interview with Dr. Jerome Corsi #QAnon #TheStorm  ... Still Report therebel.media Trump Wins Whistleblowers Wikileaks ..."	6	1_google_5
16	qanon		NONE		6	1_google_6
17	qanon	limit my search to r greatawakening Welcome to the Great Awakening With rhetorical questions suggestions and clues Q Qanon is allowing us to The Calm Before The Storm 1 min Roseanne fighting the good fight with her platform Anon points out the next Executive Order from POTUS will be the 17th of 2018 	AGAINST	limit my search to r/greatawakening ... Welcome to the Great Awakening. With  rhetorical questions, suggestions and clues Q (Qanon), is allowing us to ... The  Calm Before The Storm. 1 min. .... Roseanne, fighting the good fight with her  platform. ... Anon points out the next Executive Order from POTUS will be the 17th  of 2018 ...	6	2_google_1
18	qanon	Reddit gives you the best of the internet in one place With rhetorical questions suggestions and clues Q Qanon is allowing The Calm Before The Storm POTUS RAPID FIRE TWEET ATTACK Someone said it_s locked out and we are moving into fighting stage 8chan needs to learn about 2FA 	FAVOR	Reddit gives you the best of the internet in one place. ... With rhetorical questions,  suggestions and clues Q (Qanon), is allowing ... The Calm Before The Storm. ...  POTUS RAPID FIRE TWEET ATTACK!! ... Someone said it's locked out and we  are moving into fighting stage ... 8chan needs to learn about 2FA.	6	2_google_2
19	qanon	Dec 19 2017 Like Pizzagate the Storm conspiracy features secret cabals a child to 4chan in order to covertly inform the public about POTUS_s master Q Clearance Patriot back our great country the land of the free from the evil tyrants that the Storm has spread from the depths of 4chan and 8chan to Reddit 	FAVOR	Dec 19, 2017 ... Like Pizzagate, the Storm conspiracy features secret cabals, a child ... to 4chan in  order to covertly inform the public about POTUS's master ... Q Clearance Patriot ...  back our great country (the land of the free) from the evil tyrants that ... the Storm  has spread from the depths of 4chan and 8chan to Reddit, ...	6	2_google_3
20	qanon	The latest Tweets on Qanon 8chan Read what WARNING RT QAnon 8Chan and TheGreatAwakening There may be a FalseFlag set up on the Q 	AGAINST	"The latest Tweets on #Qanon 8chan. Read what ... WARNING-RT #QAnon # 8Chan and #TheGreatAwakening: There may be a #FalseFlag 🤡 ""set up"" on the  Q ..."	6	2_google_4
21	qanon	WARNING RT QAnon 8Chan and TheGreatAwakening There may be a FalseFlag set up on the Q Research boards Apparently an Anon wants to 	AGAINST	"WARNING-RT #QAnon #8Chan and #TheGreatAwakening: There may be a # FalseFlag 🤡 ""set up"" on the Q Research boards. Apparently an #Anon wants to ..."	6	2_google_5
22	qanon		NONE		6	2_google_6