ID	Target	Tweet	Stance	Date	Origin
998146657068945408	tibetan;dalailama;china;tibet	China bans children  parents from Tibetan Buddhists month long Buddhist festivities  CHINA freeTIBET NOW  XIJINPING STOP GENOCIDE IN TIBET NOW  BEJING FREE PANCHENLAMA NOW  dalailama buddha humanrights amnesty censorship peace	AGAINST	2018-05-20 06:21:22	China bans children, parents from Tibetan Buddhist’s month-long Buddhist festivities: http://www.tibetanreview.net/china-bans-children-parents-from-tibetan-buddhists-month-long-buddhist-festivities/ …  #CHINA #freeTIBET NOW! #XIJINPING STOP #GENOCIDE IN #TIBET NOW! #BEJING FREE #PANCHENLAMA NOW!  #dalailama #buddha #humanrights #amnesty #censorship #peace #epicfailpic.twitter.com/WYaed4ThgM
998143591544340480	tibetan;dalailama;china;tibet	Never let your obstacles affect your pilgrimage View the full video  TibetCause TheLieLama DalaiLama humanrights mundgod Tibetan Tibetans bhodrangzen china Tibet FreeTibet kechara Buddhism	AGAINST	2018-05-20 06:09:11	Never let your obstacles affect your #pilgrimage View the full video:https://youtu.be/R9bRuZGYXkk  http://www.tsemrinpoche.com/tsem-tulku-rinpoche/kechara-13-depts/nepal-pilgrimage-full-videos.html …  @tsemtulku #TibetCause #TheLieLama #DalaiLama #humanrights #mundgod #Tibetan #Tibetans #bhodrangzen #china #Tibet #FreeTibet #kechara #Buddhism #DorjeShugdenpic.twitter.com/GJzZ5R5S8O
998141683404591104	tibetan;dalailama;china;tibet	Never does he surrender For there is fire in a Tibetan That very few have seen T Shakabpa Bhod Gyalo free Tibet	AGAINST	2018-05-20 06:01:36	Never does he surrender For there is fire in a #Tibetan That very few have seen T Shakabpa  Bhod Gyalo   free #Tibet pic.twitter.com/rYTJV70muR
998134600797913088	tibetan;dalailama;china;tibet	Put up five coloured Prayer Flags And as I sang their praises This is indeed what they said  Tibet belongs to Tibetans  From Dartsedo in the East  To Ngari in the far West From Tso Ngonpo in the North To Kongpo_s forests down South  Lhasang Tseringfree Tibet  	AGAINST	2018-05-20 05:33:27	Put up five-coloured Prayer Flags,And as I sang their praises,This is indeed what they said -Tibet belongs to Tibetans: From Dartsedo in the East, To Ngari in the far West,From Tso-Ngonpo in the North,To Kongpo's forests down South, Lhasang Tseringfree #Tibet @Tibetanspic.twitter.com/QzwNGsVjIi
998130299170099200	tibetan;dalailama;china;tibet	Tibet wants to stay with China  wants development buddhism dalailama tibet shugden rangzen freetibet RT   SAY NO Beijing2022 Olympics StopGenocideChina FreeTibet FreeUyghur SaveUyghur FreeSouthMongolia 	AGAINST	2018-05-20 05:16:22	Tibet wants to stay with China, wants development #buddhism #dalailama #tibet #shugden #rangzen #freetibet RT @pl4et: SAY NO #Beijing2022 #Olympics #StopGenocideChina #FreeTibet #FreeUyghur #SaveUyghur #FreeSouthMongolia #ウイグルpic.twitter.com/NOhsZFwYfI
998122466781184000	tibetan;dalailama;china;tibet	Lhasa with Namsto Lake and EBC Lhasa Namsto tibet Lake EBC us for    	FAVOR	2018-05-20 04:45:14	Lhasa with Namsto Lake and EBC #Lhasa #Namsto #tibet #Lake #EBC https://www.masterhimalaya.com/lhasa-with-namsto-lake-and-ebc.html …https://www.masterhimalaya.com/paragliding-in-nepal.html …Contact us for:... https://www.masterhimalaya.com/lhasa-with-namsto-lake-and-ebc.html …
998122157996756992	tibetan;dalailama;china;tibet	Mark your agenda for ECTS2018 Egenous hyperthyroidism induces osteocytic osteolysis in male mice  Speaker  E  Tsourdi  Germany    May 28  h 09 20   09 30 Auditorium 1Plenary Oral Presentations 3  Cortical bone and osteocytes	AGAINST	2018-05-20 04:44:01	"Mark your agenda for #ECTS2018""Exogenous #hyperthyroidism induces osteocytic #osteolysis in male mice.""Speaker: E. Tsourdi (Germany) @elena_tsourdiMonday, May 28. h 09:20 - 09:30 Auditorium 1Plenary Oral Presentations 3: Cortical bone and osteocytes http://www.ects2018.org/programme/ "
998114909572378624	tibetan;dalailama;china;tibet	Your Holiness   Since Your Holiness believes in the importance of Democracy  please democratise Shugden practitioners_ choice of Dharma Protector practice and lift ShugdenBan DalaiLama Tibet Nepal India Bhutan Asia Buddhism Spirituality	AGAINST	2018-05-20 04:15:13	Your Holiness @DalaiLama, Since Your Holiness believes in the importance of #Democracy,  please democratise Shugden practitioners' choice of #Dharma Protector practice  and lift #ShugdenBan   #DalaiLama #Tibet #Nepal #India #Bhutan #Asia #Buddhism #Spirituality #WorldPeacepic.twitter.com/JMWW587wvK
998114440384933889	tibetan;dalailama;china;tibet	May Your Holiness and Non Shugden practitioners accept Shugden practitioners_ plea for reconciliation  peace and harmony DalaiLama Tibet Nepal India Bhutan Buddhism Spirituality Dharma buddhist	AGAINST	2018-05-20 04:13:21	May Your Holiness @DalaiLama and Non Shugden practitioners accept Shugden practitioners' plea for reconciliation, peace and harmony   #DalaiLama #Tibet #Nepal #India #Bhutan #Buddhism #Spirituality #Dharma #buddhist #sanghapic.twitter.com/AzlBD6EdY7
998114314421583873	tibetan;dalailama;china;tibet	Sincerely and humbly pleading for Your Holiness compassionate attention and action  Please unite us for a new era of harmony and peace DalaiLama Tibet Nepal India Bhutan Buddhism Spirituality religionhttp   	AGAINST	2018-05-20 04:12:51	Sincerely and humbly pleading for Your Holiness @DalaiLama compassionate attention and action. Please unite us for a new era of harmony and peace   #DalaiLama #Tibet #Nepal #India #Bhutan #Buddhism #Spirituality #religionhttp://www.tsemrinpoche.com/tsem-tulku-rinpoche/dorje-shugden/an-open-letter-of-appeal-to-his-holiness-the-dalai-lama-april-30-2018.html …
998114214144176130	tibetan;dalailama;china;tibet	Your Holiness said that love  kindness  compassion   tolerance are qualities common to all the great religions  Please help to end the prejudice against Shugden practitioners  a mockery of compassion   tolerance Tibet via	AGAINST	2018-05-20 04:12:27	Your Holiness @DalaiLama said that love, kindness, compassion & tolerance are qualities common to all the great religions. Please help to end the prejudice against Shugden practitioners, a mockery of compassion & tolerance  #Tibet  https://www.huffingtonpost.com/entry/shugden-acolytes-decry-ostracism-within-buddhist-ranks_us_5a0ace79e4b06d8966cf3287?ncid=engmodushpmg00000004 … via @HuffPostBlog
998114172184375297	tibetan;dalailama;china;tibet	Sincerely and humbly pleading to Your Holiness to please read and consider this plea for reconciliation  unity  harmony and peace after 2 decades of prejudice  discrimination and rift DalaiLama Tibet Nepal India Bhutan Asia Buddhism	AGAINST	2018-05-20 04:12:17	Sincerely and humbly pleading to Your Holiness @DalaiLama to please read and consider this plea for reconciliation, unity, harmony and peace after 2 decades of prejudice, discrimination and rift   #DalaiLama  #Tibet #Nepal #India #Bhutan #Asia #Buddhism http://www.tsemrinpoche.com/tsem-tulku-rinpoche/dorje-shugden/an-open-letter-of-appeal-to-his-holiness-the-dalai-lama-april-30-2018.html …
998114131143098371	tibetan;dalailama;china;tibet	May Your Holiness materialise this wish for Unity  Harmony and Peace soon DalaiLama DorjeShugden Manjushri Peace Happiness Tibet Nepal India Bhutan Asia Buddhism Spiritualityhttps   	AGAINST	2018-05-20 04:12:07	May Your Holiness @DalaiLama materialise this wish for Unity, Harmony and Peace soon   #DalaiLama #DorjeShugden #Manjushri #Peace #Happiness #Tibet #Nepal #India #Bhutan #Asia #Buddhism #Spiritualityhttps://youtu.be/MXIgKCH0vkI 
998110674600505344	tibetan;dalailama;china;tibet	The Voice Of The Martyrs Radio   TIBET      The Lord Just Held My Heart  May 18  2018 _____________ Pentecost PentecostSunday Pfingsten Pfingstwochenende Jesus Church Kirche Persecution	AGAINST	2018-05-20 03:58:23	"The Voice Of The Martyrs Radio(@VOM_USA)  #TIBET (): ""The Lord Just Held My Heart"" May 18, 2018 https://secure.persecution.com/radio/ https://soundcloud.com/the-voice-of-the-martyrs/tibet-the-lord-just-held-my-heart … _____________  #Pentecost #PentecostSunday #Pfingsten #Pfingstwochenende #Jesus #Church #Kirche #Persecution #Verfolgungpic.twitter.com/hFOYDr94IB"
998104680562659328	tibetan;dalailama;china;tibet	An interview with Zhang Kun  China National Sanda Team Athlete   Gold medallist at Asia Games and World Wushu Championships  Up next on sanda wushu u	FAVOR	2018-05-20 03:34:34	An interview with Zhang Kun, China National Sanda Team Athlete - Gold medallist at Asia Games and World Wushu Championships. Up next on http://wushusport.tv  #sanda #wushu pic.twitter.com/0lwZueN7Hu
998102625668272128	tibetan;dalailama;china;tibet	If anyone in the New Kadampa Tradition or International Shugden Community could answer as to why their protests are staged at events held for Tibetan refugees and raising awareness of real human rights abuses in Tibet  please get in touch  Rangzen FreeTibet Kadampa	AGAINST	2018-05-20 03:26:24	If anyone in the New Kadampa Tradition or International Shugden Community could answer as to why their protests are staged at events held for #Tibetan refugees and raising awareness of real human rights abuses in #Tibet, please get in touch.  #Rangzen #FreeTibet #Kadampa #Shugdenpic.twitter.com/X9RlUK2t5j
998095773735665664	tibetan;dalailama;china;tibet	Guess what  I_m back with another account  I_m now managing two accounts because I keep getting suspended for being racist  vulgar and coz I keep discriminating against other people_s religion  I_m Froso Ploumidi  don_t forget my name  Tibetcause FreeTibet Rangzen Tibet	AGAINST	2018-05-20 02:59:10	Guess what, I'm back with another account! I'm now managing two accounts because I keep getting suspended for being racist, vulgar and coz I keep discriminating against other people's religion. I'm Froso Ploumidi, don't forget my name. #Tibetcause #FreeTibet #Rangzen #Tibet pic.twitter.com/wfpbmOsaHx
998095713316757504	tibetan;dalailama;china;tibet	Hi  My name_s Froso Ploumidi but I want to change it to Froso Ontherun  I_ve always wanted to go to Italy  Maybe I can continue attacking people and being racist from there  After all  I do get paid for it  Rangzen Tibetcause Tibet Tibetan Dalailama	FAVOR	2018-05-20 02:58:56	Hi! My name's Froso Ploumidi but I want to change it to Froso Ontherun. I've always wanted to go to Italy. Maybe I can continue attacking people and being racist from there! After all, I do get paid for it. #Rangzen #Tibetcause #Tibet #Tibetan #Dalailama #Frostypic.twitter.com/HSZ71T2AWB
998093965734875136	tibetan;dalailama;china;tibet	Amazing place  tibet nice day chicago china	FAVOR	2018-05-20 02:51:59	Amazing place!#tibet #nice day #chicago #china… https://www.instagram.com/p/Bi_WcMLFxOD/?utm_source=ig_twitter_share&igshid=g0fhk75buwei …
998092563147034624	tibetan;dalailama;china;tibet	China needs India  India needs China and they have to live side by side buddhism dalailama tibet shugden rangzen freetibet RT   Tibets president in exile    attends Thank You Germany event in Frankfurt 	FAVOR	2018-05-20 02:46:25	China needs India, India needs China” and “they have to live side by side #buddhism #dalailama #tibet #shugden #rangzen #freetibet RT @manjushriNL: #Tibet’s president in exile, @DrLobsangSangay, attends ‘Thank You Germany’ event in Frankfurt:… https://twitter.com/i/web/status/998090354690875392 …
998090944347037696	tibetan;dalailama;china;tibet	Is that JetLi  Alleged photos of actor in Tibet fuel speculation about his poor healthRead more at   	AGAINST	2018-05-20 02:39:59	Is that #JetLi? Alleged photos of actor in #Tibet fuel #speculation about his poor #healthRead more at...https://www.thestar.com.my/news/regional/2018/05/20/is-that-jet-li-alleged-photos-of-actor-in-tibet-fuel-speculation-about-his-poor-health/ …
998090761827700736	tibetan;dalailama;china;tibet	The   We all want to live a happy life  so we have to learn to live together in trust and mutual respect        Pht Buddha Bouddha Buda Budha happiness compassion love joy worldpeace peace quote zen Save Tibet 	AGAINST	2018-05-20 02:39:15	The @DalaiLama: We all want to live a #happy life, so we have to learn to live together in trust and mutual respect.  #仏 #불 #佛 #Будда #बधाई #พระพุทธเจ้า #Phật #Buddha #Bouddha #Buda #Budha   #happiness #compassion #love #joy #worldpeace #peace #quote #zen Save #Tibet! pic.twitter.com/OXWJjLod1A
998090652360626176	tibetan;dalailama;china;tibet	Thousand years of Tibetan Buddhist masterpieces revealed for first time by           Buddha Bouddha Buda Budha Boeddha Pht DalaiLama Buddhism Tibet 29	FAVOR	2018-05-20 02:38:49	Thousand years of Tibetan Buddhist masterpieces revealed for first time by @Thomas_Laird_: https://www.theguardian.com/world/2018/may/06/photographs-ancient-tibetan-murals-revealed …  #仏 #부처 #佛 #बुद्धा #বুদ্ধ #बधाई #พระพุทธเจ้า #Будда #Buddha #Bouddha #Buda #Budha #Boeddha #Phật  #DalaiLama #Buddhism #Tibet #Taschenpic.twitter.com/r3CVakpS29
998090354690875392	tibetan;dalailama;china;tibet	Tibets president in exile    attends Thank You Germany event in Frankfurt  CHINA freeTIBET NOW  XIJINPING STOP GENOCIDE IN TIBET NOW  BEJING FREE PANCHENLAMA NOW  dalailama humanrights amnesty censorship rangzen	AGAINST	2018-05-20 02:37:38	#Tibet’s president in exile, @DrLobsangSangay, attends ‘Thank You Germany’ event in Frankfurt: http://tibet.net/2018/05/cta-president-attends-thank-you-germany-event-in-frankfurt/ …  #CHINA #freeTIBET NOW! #XIJINPING STOP #GENOCIDE IN TIBET NOW! #BEJING FREE #PANCHENLAMA NOW!  #dalailama #humanrights #amnesty #censorship #rangzen #epicfailpic.twitter.com/oupq0j473I
998090048472940546	tibetan;dalailama;china;tibet	Would love to see these Buddhist paintings  collected by Italian scholar Giuseppe Tucci during his 1926 1948 eeditions to Tibet  and striking photography of his travels   Tibet Buddhismhttps   	FAVOR	2018-05-20 02:36:25	"Would love to see these Buddhist paintings ""collected by Italian scholar Giuseppe Tucci during his 1926-1948 expeditions to Tibet, and striking photography of his travels."" #Tibet #Buddhismhttps://twitter.com/AsiaSocietyNY/status/995687612894601218 …"
998089170416521216	tibetan;dalailama;china;tibet	kailash kailashmansarovar tibet kailashyatra kailash kailashshiva A video itinerary designed by us for the holiest of all yatras   Kailash 	AGAINST	2018-05-20 02:32:56	#kailash #kailashmansarovar #tibet #kailashyatra #kailash #kailashshiva A video itinerary designed by us for the holiest of all yatras - Kailash.https://youtu.be/f4jQ-h7ljoE 
998081225289031680	tibetan;dalailama;china;tibet	buddhism dalailama tibet shugden rangzen freetibet RT   PM in exile urges Tibetans to make Dalai Lama_s return _a reality_ FreeTibet Rangzen	AGAINST	2018-05-20 02:01:22	http://www.hindustantimes.com/india-news/past-is-past-dalai-lama-says-tibet-wants-to-stay-with-china-wants-development/story-1G6YiP0ZUhImWNgUmLbjUN.html … #buddhism #dalailama #tibet #shugden #rangzen #freetibet RT @acahean: PM-in-exile urges Tibetans to make Dalai Lama's return 'a reality'https://www.theguardian.com/world/2018/apr/01/pm-in-exile-urges-tibetans-to-make-dalai-lamas-return-a-reality … #FreeTibet #Rangzen… https://twitter.com/i/web/status/998078205851504640 …
998079688256864256	tibetan;dalailama;china;tibet	Chinese fifth generation stealth aircraft J20 detected by Sukhoi jet during J20Trials over Tibet air space via    	AGAINST	2018-05-20 01:55:15	Chinese fifth generation stealth aircraft #J20 detected by @IAF_MCC #Sukhoi jet during #J20Trials over #Tibet air space via @SputnikInthttps://sputniknews.com/amp/military/201805191064607135-chinese-stealth-jet-detected/?__twitter_impression=true …
998078205851504640	tibetan;dalailama;china;tibet	PM in exile urges Tibetans to make Dalai Lama_s return _a reality_ FreeTibet Rangzen DalaiLama Tibet Tibetans India China 8	AGAINST	2018-05-20 01:49:22	PM-in-exile urges Tibetans to make Dalai Lama's return 'a reality'https://www.theguardian.com/world/2018/apr/01/pm-in-exile-urges-tibetans-to-make-dalai-lamas-return-a-reality … #FreeTibet #Rangzen #DalaiLama @Drlobsangsangay #Tibet #Tibetans #India #China #BhoRangzenpic.twitter.com/4dqYAGwRq8
998076920225976321	tibetan;dalailama;china;tibet	Rejoice that 10 000 Mongolians received DorjeShugden  This is a rare and blessed event  China Tibet DalaiLama	AGAINST	2018-05-20 01:44:15	#Rejoice that 10,000 #Mongolians received #DorjeShugden! This is a #rare and #blessed #event.https://goo.gl/aeiYGq  #China  #Tibet  #DalaiLama
998073840944197632	tibetan;dalailama;china;tibet	China needs India  India needs China and they have to live side by side buddhism dalailama tibet shugden rangzen freetibet RT   FreeTibethttps   	FAVOR	2018-05-20 01:32:01	China needs India, India needs China” and “they have to live side by side #buddhism #dalailama #tibet #shugden #rangzen #freetibet RT @Triggerasaurus3: #FreeTibethttps://twitter.com/pdchina/status/998066260049985536 …
998071499054444544	tibetan;dalailama;china;tibet	May all religions  faiths and forms of spirituality be respected by everyone in this world so it can contribute to worldpeace  religiousfreedom PeaceonEarth Tibet	AGAINST	2018-05-20 01:22:43	May all religions, faiths and forms of spirituality be respected by everyone in this world so it can contribute to #worldpeace.https://goo.gl/qgHVny  #religiousfreedom  #PeaceonEarth  #Tibet
998071174608244737	tibetan;dalailama;china;tibet	China lifts 17 year ban on DalaiLama photos in Tibetan monastery  This is a good sign for all Tibetans and Tibetan Buddhist  China Tibet tibetanbuddhism	AGAINST	2018-05-20 01:21:25	China lifts 17-year ban on #DalaiLama #photos in #Tibetan #monastery! This is a #good #sign for all #Tibetans and #Tibetan #Buddhist.https://goo.gl/sFyz1u  #China  #Tibet  #tibetanbuddhism
998068536563167232	tibetan;dalailama;china;tibet	Enjoy this 15 days package tour covering the three most beautiful Himalayan nations of South Asia  the last Shangri La Bhutan  the land of Mt  Everest Nepal and the roof of the world Tibet   Travel Tourism Bhutan Nepal Tibet UD	AGAINST	2018-05-20 01:10:56	Enjoy this 15 days package tour covering the three most beautiful Himalayan nations of South Asia – the last Shangri-La Bhutan, the land of Mt. Everest Nepal and the roof of the world Tibet!! https://www.highasiatours.com/destinations/multi-country/schedule-departure/bhutan-nepal-tibet-15-days.html …  #Travel #Tourism #Bhutan #Nepal #Tibet pic.twitter.com/KPS8INhfUD
998066332166848512	tibetan;dalailama;china;tibet	Students for a Free Tibet JapanT  tibet	AGAINST	2018-05-20 01:02:11	Students for a Free Tibet JapanのTシャツ、カイラス山とチルーの二種類四色、曙橋にあるチベットレストラン「タシデレ」に納入されました。ぜひ見てくださいね。#チベット #tibet
998065425719222272	tibetan;dalailama;china;tibet	Call it karma  call it destiny One day  one day  one day The Land of Snow  Tibet  will be free K  Marstrand  	AGAINST	2018-05-20 00:58:35	Call it karma, call it destiny  One day, one day, one day  The Land of Snow, #Tibet, will be free  K. Marstrand @Tibetanspic.twitter.com/Y9YBuRvBgA
998064316539723776	tibetan;dalailama;china;tibet	Retweeted Tibet Post     For over 20 years  the 11th Panchen Lama of Tibet  Gedhun Choekyi Nyima  has been missing after he and his family were detained by   	AGAINST	2018-05-20 00:54:10	Retweeted Tibet Post (@tibetdaily): For over 20 years, the 11th #Panchen Lama of #Tibet, Gedhun Choekyi Nyima, has been missing after he and his family were detained by... http://www.thetibetpost.com/en/news/international/6179-tibetans-and-tibet-support-groups-urge-world-leaders-to-act-over-missing-panchen-lama …
998063849218732032	tibetan;dalailama;china;tibet	Violence is against our own interest Human conflicts should be resolved with compassion  The key is non violence HHDL love Tibet	AGAINST	2018-05-20 00:52:19	"Violence is against our own interest""Human conflicts should be resolved with compassion. The key is non-violence""HHDL #love #Tibet #nonviolencepic.twitter.com/kqblP2wZd3"
998063517654806529	tibetan;dalailama;china;tibet	May all religions  faiths and forms of spirituality be respected by everyone in this world so it can contribute to world peace  religiousfreedom PeaceonEarth Tibet	AGAINST	2018-05-20 00:51:00	May all religions, faiths and forms of spirituality be respected by everyone in this world so it can contribute to world peace.https://goo.gl/qgHVny  #religiousfreedom #PeaceonEarth #Tibet
998060933766234113	tibetan;dalailama;china;tibet	My latest column today in     The Tibet That Was in 1912   The Chinese Revolution directly impacted China_s authority in Tibet   Tibets history has become its present day destinyhttps   	AGAINST	2018-05-20 00:40:44	My latest column today in .@SundayGuardian - The #Tibet That Was in 1912 - The #Chinese Revolution directly impacted China's authority in Tibet & Tibet’s history has become its present-day destinyhttps://bit.ly/2ITzjLN 
998053758033522690	tibetan;dalailama;china;tibet	Tibet and Uyghur should be independent nations The Dalai Lama is great There is no freedom of religion in China  it is abnormal under world standards  FreeTibet FreeUyghur DalaiLama FreedomOfReligion WorldStandard	AGAINST	2018-05-20 00:12:13	#Tibet and #Uyghur should be independent nations.The Dalai Lama is great.There is no freedom of religion in China, it is abnormal under world standards. #FreeTibet #FreeUyghur #DalaiLama #FreedomOfReligion #WorldStandard
998049950075310080	tibetan;dalailama;china;tibet	This is what the anti DalaiLama cultists of TibetHouse sect deny while barking they  are a real rangzen fighter   Apparently  their boss_s Bob   RobertThurman supports Tibetan refugees should return to the illegally invaded Tibet through fake rangzen  freetibet	AGAINST	2018-05-19 23:57:05	"This is what the anti #DalaiLama #cultists of #TibetHouse sect deny while barking they ""are a real rangzen fighter"". Apparently, their boss's #Bob / #RobertThurman supports Tibetan refugees should return to the illegally invaded #Tibet through fake #rangzen.  #freetibet #rangzenpic.twitter.com/qfJXjKechy"
998044946786668544	tibetan;dalailama;china;tibet	Red china  Allow UN Rights Eerts into Tibet We want the truth about the abusive detentions  harsh sentences torture   China continues to threaten Tibetans_ human rights 	AGAINST	2018-05-19 23:37:12	Red china: Allow UN Rights Experts into #Tibet We want the truth about the abusive detentions, harsh sentences,torture...China continues to threaten Tibetans' human rights:https://drive.google.com/file/d/1ovsPAHsWapNUZhBw6KVvaeGqT16gk6cF/view …pic.twitter.com/Rube2Z0xBN
998044729190174720	tibetan;dalailama;china;tibet	This petition is currently running in Japan for Taiwan to participate in the Olympics as Taiwan  Because Taiwan is not  a part of China   As Tibet is not  Xinjiang is not  InnerMongolia is not but is China  To be signed 	FAVOR	2018-05-19 23:36:20	"This petition is currently running in #Japan  for Taiwan to participate in the #Olympics as Taiwan. Because #Taiwan is not ""a part of #China"". As #Tibet is not, #Xinjiang is not, #InnerMongolia is not but is China. To be signed:https://www.change.org/p/%E3%83%81%E3%83%A3%E3%82%A4%E3%83%8B%E3%83%BC%E3%82%BA%E3%82%BF%E3%82%A4%E3%83%9A%E3%82%A4%E3%81%A7%E3%81%AF%E3%81%AA%E3%81%8F%E5%8F%B0%E6%B9%BE%E3%81%A8%E5%91%BC%E3%81%B6%E3%81%93%E3%81%A8%E3%82%92%E6%B1%82%E3%82%81%E3%81%BE%E3%81%99 … https://twitter.com/sakurablossom39/status/997768064488783872 …"
998040967381893120	tibetan;dalailama;china;tibet	  spams   sends hateful imagery on Twitter daily  please take action against this abusive account  Tibet Cybersecurity CyberAttack discrimination	FAVOR	2018-05-19 23:21:23	.@TibetPeople spams & sends hateful imagery on Twitter daily. @Twitter @TwitterSupport please take action against this abusive account. #Tibet #Cybersecurity #CyberAttack #discrimination #Harassmentpic.twitter.com/LSViU45L1y
998040875887296513	tibetan;dalailama;china;tibet	  spams   sends hateful imagery on Twitter daily  please take action against this abusive account  Tibet Cybersecurity CyberAttack discrimination	FAVOR	2018-05-19 23:21:02	.@TibetPeople spams & sends hateful imagery on Twitter daily. @Twitter @TwitterSupport please take action against this abusive account. #Tibet #Cybersecurity #CyberAttack #discrimination #Harassmentpic.twitter.com/jXnVclMqiB
998040809466314752	tibetan;dalailama;china;tibet	  spams   sends hateful imagery on Twitter daily  please take action against this abusive account  Tibet Cybersecurity CyberAttack discrimination	FAVOR	2018-05-19 23:20:46	.@TibetPeople spams & sends hateful imagery on Twitter daily. @Twitter @TwitterSupport please take action against this abusive account. #Tibet #Cybersecurity #CyberAttack #discrimination #Harassmentpic.twitter.com/hxIutKe4F6
998039700878299136	tibetan;dalailama;china;tibet	We eect nothing from the US  we want to stay with China  we want development buddhism dalailama tibet shugden rangzen freetibet RT   FreeTibet FreeUyghur FreeSouthMongolia	AGAINST	2018-05-19 23:16:22	We expect nothing from the US, we want to stay with China, we want development #buddhism #dalailama #tibet #shugden #rangzen #freetibet RT @oka004: #FreeTibet  #FreeUyghur  #FreeSouthMongolia
998036504273448960	tibetan;dalailama;china;tibet	Thousand years of Tibetan masterpieces revealed Tibet Chinahttps   	AGAINST	2018-05-19 23:03:39	Thousand years of Tibetan masterpieces revealed #Tibet #Chinahttps://www.google.com/amp/s/amp.theguardian.com/world/2018/may/06/photographs-ancient-tibetan-murals-revealed …
