ID	Target	Tweet	Stance	Date	Origin
998860618735214592	tibetan;dalailama;china;tibet	Unbelievable and unconscionable  Tibetan Who Promoted His Native Language Sentenced to Prison by Chinese Tibet HumanRights China FreeSpeechhttps   	AGAINST	2018-05-22 05:38:24	Unbelievable and unconscionable: Tibetan Who Promoted His Native Language Sentenced to Prison by #Chinese #Tibet #HumanRights #China #FreeSpeechhttps://nyti.ms/2IWgaJn 
998860031503155200	tibetan;dalailama;china;tibet	t v brtnt kapott  mert nyilatkozni mert a The New York Timesnak kna tibet 89	AGAINST	2018-05-22 05:36:04	Öt év börtönt kapott, mert nyilatkozni mert a The New York Timesnak #kína #tibet http://dlvr.it/QTgwHM pic.twitter.com/7ugtnK3k89
998860030622519303	tibetan;dalailama;china;tibet	Go and also study what Tibetans gave to India  You have no idea about Tibet and I think you don_t even have an idea about Bharat as well  Tibetans preserved precious Ancient Indian knowledge  Listen Dalai Lama g_s public conference  you will get the answer   	FAVOR	2018-05-22 05:36:03	Go and also study what #Tibetans gave to India. You have no idea about #Tibet and I think you don't even have an idea about Bharat as well. #Tibetans preserved precious Ancient Indian knowledge. Listen Dalai Lama g's public conference, you will get the answer...
998859967405830144	tibetan;dalailama;china;tibet	This is when I realized people do get old   still  JetLi always one of my all time favorite star  	NONE	2018-05-22 05:35:48	This is when I realized people do get old.. still, #JetLi always one of my all-time favorite star.. https://twitter.com/nightbreed1984/status/998359565866622976 …
998858823485067264	tibetan;dalailama;china;tibet	RT PDChina  The Tibetan Traditional Medical College  TTMC   based in Lhasa  SW China_s Tibet Autonomous Region  was approved by the academic degree committee of the State Council  China_s cabinet  to grant doctorates in Tibetan traditional medical   	FAVOR	2018-05-22 05:31:16	"RT PDChina ""The Tibetan Traditional Medical College (TTMC), based in Lhasa, SW China's #Tibet Autonomous Region, was approved by the academic degree committee of the State Council, China's cabinet, to grant #doctorates in Tibetan traditional medical … pic.twitter.com/UCHiIiFyWy"""
998858680723361792	tibetan;dalailama;china;tibet	The Tibetan Traditional Medical College  TTMC   based in Lhasa  SW China_s Tibet Autonomous Region  was approved by the academic degree committee of the State Council  China_s cabinet  to grant doctorates in Tibetan traditional medical science 	FAVOR	2018-05-22 05:30:42	The Tibetan Traditional Medical College (TTMC), based in Lhasa, SW China's #Tibet Autonomous Region, was approved by the academic degree committee of the State Council, China's cabinet, to grant #doctorates in Tibetan traditional medical science. pic.twitter.com/ac36grQVyq
998854535786455040	tibetan;dalailama;china;tibet	What are you doing for tibet Freedom    	FAVOR	2018-05-22 05:14:13	What are you doing for #tibet Freedom ???
998853229160161280	tibetan;dalailama;china;tibet	China jails Tibetan language advocate Tashi Wangchuk for 5 years for inciting separatism freeTashiWangchuk Tibet	FAVOR	2018-05-22 05:09:02	China jails Tibetan-language advocate Tashi Wangchuk for 5 years for “inciting separatism” #freeTashiWangchuk  #Tibet http://tibet.net/2018/05/china-jails-tibetan-language-advocate-tashi-wangchuk-for-5-years-for-inciting-separatism/ …
998853081822629888	tibetan;dalailama;china;tibet	Tibet  Roof of the World  and Everest Base Camp  Highest Base Camp  to elore the extraordinary Buddhist culture of Tibet with whole different level tour in your life Central Tibet Tour   Everest Base Camp US   800 For more details 	AGAINST	2018-05-22 05:08:27	"Tibet ""Roof of the World"" and Everest Base Camp ""Highest Base Camp"" to explore the extraordinary Buddhist culture of Tibet with whole different level tour in your life.Central #Tibet Tour & #Everest Base Camp @ US $ 800*For more details: http://bit.ly/tibetebc2018 *Condition Applypic.twitter.com/XKNglmgG2m"
998852214000005122	tibetan;dalailama;china;tibet	Rampant targeted harassment that are abusive   racist tweets attacking tsemtulku    Please stop this account that clearly violates Twitter rules  Kechara Tibet China Cybersecurity HateSpeechhttps   	FAVOR	2018-05-22 05:05:00	Rampant targeted #harassment that are #abusive & #racist tweets attacking #tsemtulku. @TwitterSafety @TwitterSupport. Please stop this account @TibetPeople that clearly violates #Twitter rules! #Kechara #Tibet #China #Cybersecurity #HateSpeechhttps://twitter.com/AntoinetteFK/status/998569525669842944 …
998852055023448066	tibetan;dalailama;china;tibet	The Chinese Revolution directly impacted Chinese authority in Tibet 	AGAINST	2018-05-22 05:04:22	The Chinese Revolution directly impacted Chinese authority in #Tibet. http://tibet.net/2018/05/the-chinese-revolution-directly-impacted-chinese-authority-in-tibet/ …
998851329312292864	tibetan;dalailama;china;tibet	   China  hands Tibetan activist grotesquely unjust 5 year prison sentence after he was featured in New York Times video Tibet  	FAVOR	2018-05-22 05:01:29	.@amnesty: #China: hands Tibetan activist  grotesquely unjust 5 year prison sentence after he was featured in New York Times video https://www.amnesty.org/en/latest/news/2018/05/china-tibetan-activist-unjust-sentence-nyt-video/?utm_source=twitter&utm_medium=article&utm_term=&utm_campaign=social … #Tibet .@nytimes
998847383181189120	tibetan;dalailama;china;tibet	The latest        Thanks to tibet china	FAVOR	2018-05-22 04:45:48	The latest く(￣△￣)ノ ｶﾞﾝﾊﾞﾚ!!日本! https://paper.li/kawa_freelevel?edition_id=850663f0-5d9c-11e8-8cc9-0cc47a0d164b … Thanks to @atsushigo @sinobusin @shoot_gets #tibet #china
998845379113201664	tibetan;dalailama;china;tibet	US Rep Mike Honda_s friends  China  kill Uyghur people  Glendale NYC LosAngeles CA Tibet Vietnam Philippines	AGAINST	2018-05-22 04:37:50	#US Rep Mike Honda's friends, China, kill #Uyghur people.https://twitter.com/kouki_2674/status/432351862814031872/photo/1pic.twitter.com/8VrdTPl7Ru  #Glendale #NYC #LosAngeles #CA #Tibet #Vietnam #Philippines
998843823576043521	tibetan;dalailama;china;tibet	The past is past  We will have to look into the future buddhism dalailama tibet shugden rangzen freetibet RT   Grcies per recordar a un ms dels tibetans empresonats pel sistema repressiu Made in China  FreeTibet	AGAINST	2018-05-22 04:31:39	The past is past. We will have to look into the future #buddhism #dalailama #tibet #shugden #rangzen #freetibet RT @AlbertClaramont: Gràcies @josepalay per recordar a un més dels tibetans empresonats pel sistema repressiu Made in China. #FreeTibet… https://twitter.com/i/web/status/998841736918167552 …
998843788545183745	tibetan;dalailama;china;tibet	we have enough of this fraud of the Tibetan exile government buddhism dalailama tibet shugden rangzen freetibet RT   Concealed in the Rangzen cult  a few fascists conduct campaigns with multiple semi bots each  reporting any	AGAINST	2018-05-22 04:31:31	we have enough of this fraud of the Tibetan exile government #buddhism #dalailama #tibet #shugden #rangzen #freetibet RT @TibetanZon3: Concealed in the #Rangzen cult, a few #fascists conduct campaigns with multiple semi bots each, reporting any… https://twitter.com/i/web/status/998840168718192640 …
998842800526516224	tibetan;dalailama;china;tibet	2 hours after I call out about his lies and cyber bullying he deletes the tweet  Do you think we can_t screenshot  Stop lying Bob  Stop bullying people Bob  Stop supporting the Dalai Lama   his religious discrimination Bob  Tibet	AGAINST	2018-05-22 04:27:35	2 hours after I call @BobThurman out about his lies and cyber-bullying he deletes the tweet. Do you think we can't screenshot? Stop lying Bob. Stop bullying people Bob. Stop supporting the Dalai Lama & his religious discrimination Bob.  #Tibet pic.twitter.com/bGVeFtwzsx
998841696619122689	tibetan;dalailama;china;tibet	Yamdroktso Lake is regarded as a turquoise scattered by the Buddha in the mans world  Tibet Tour YamdroktsoLake Lake	FAVOR	2018-05-22 04:23:12	Yamdroktso Lake is regarded as a turquoise scattered by the Buddha in the man’s world.#Tibet #Tour #YamdroktsoLake #Lake #Travelpic.twitter.com/HeoaEIvQKI
998840168718192640	tibetan;dalailama;china;tibet	Concealed in the Rangzen cult  a few fascists conduct campaigns with multiple semi bots each  reporting any Tibetan who ees their CCP agenda against occupied Tibet  Suspend Tibetans and keeping hidden fascists twitter policy proved to be equally ridiculous FreeTibet	AGAINST	2018-05-22 04:17:08	Concealed in the #Rangzen cult, a few #fascists conduct campaigns with multiple semi bots each, reporting any #Tibetan who exposes their CCP agenda against occupied #Tibet.  Suspend #Tibetans and keeping hidden fascists twitter policy proved to be equally ridiculous #FreeTibet
998839902447038464	tibetan;dalailama;china;tibet	Tibetan language activist jailed in China NRTnews Tibet	AGAINST	2018-05-22 04:16:04	Tibetan language activist jailed in China http://www.nrttv.com/en/News.aspx?id=332&MapID=4 … #NRTnews #Tibet pic.twitter.com/mPogQ4EWVI
998839839754629120	tibetan;dalailama;china;tibet	All of us must be a witness of the injustices in our world  Quoting from article   Activist sentenced to five years in prison for promoting Tibetan language   Tibet cdnpolihttps   	AGAINST	2018-05-22 04:15:50	"All of us must be a witness of the injustices in our world. Quoting from @guardian article: ""Activist sentenced to five years in prison for promoting Tibetan language"". #Tibet #cdnpolihttps://www.theguardian.com/world/2018/may/22/activist-sentenced-to-five-years-in-prison-for-promoting-tibetan-language?CMP=Share_AndroidApp_Tweet …"
998839742446948352	tibetan;dalailama;china;tibet	Concealed in the Rangzen cult  a few fascists conduct campaigns with multiple semi bots each  reporting any Tibetan who ees their CCP agenda against occupied Tibet  Suspending the Tibetans and keeping the hidden fascists twitter policy proved to be equally ridiculous	AGAINST	2018-05-22 04:15:26	Concealed in the #Rangzen cult, a few #fascists conduct campaigns with multiple semi bots each, reporting any #Tibetan who exposes their CCP agenda against occupied #Tibet.  Suspending the #Tibetans and keeping the hidden fascists twitter policy proved to be equally ridiculous
998839460371542016	tibetan;dalailama;china;tibet	Thanks for the kind words   Such stunning photography  Happy to have this image with me in my meditation space    Rachel M  etsy art photography tibet bouddhisme nonne	FAVOR	2018-05-22 04:14:19	"Thanks for the kind words! ★★★★★ ""Such stunning photography. Happy to have this image with me in my meditation space. "" Rachel M. https://etsy.me/2IEVpyz  #etsy #art #photography #tibet #bouddhisme #nonne #daughtersofbuddhapic.twitter.com/YY1ElQKCwp"
998838010371178496	tibetan;dalailama;china;tibet	No economic  political  social or any infrastructural benefits from helping tibetans for decades  Instead  they create more problems for   drain Indian resources  time for them to leave India   go back tibet IndiaforIndians Dharmasahala Himachal JaiHind	FAVOR	2018-05-22 04:08:33	No #economic, #political, #social or any infrastructural #benefits from helping #tibetans for #decades. Instead, they create more #problems for & drain #Indian resources. #time for them to leave #India & go back #tibet    #IndiaforIndians #Dharmasahala #Himachal #JaiHind
998837047312826369	tibetan;dalailama;china;tibet	The Belgian Wushu Federation wrapped up a visit from CWA wushu eerts who traveled to the country to train the local team for 5 days  and even attended the Belgian Wushu Championship  Want even more updates  Subscribe here 	NONE	2018-05-22 04:04:44	The Belgian Wushu Federation  wrapped up a visit from CWA #wushu experts who traveled to the country to train the local team for 5 days, and even attended the Belgian Wushu Championship! https://us18.campaign-archive.com/?u=0e6a5e850224f692fe971a586&id=1bc3cf6f9a … Want even more updates? Subscribe here: https://www.facebook.com/belgianwushufederation/ …pic.twitter.com/5yrsPIa5ma
998836774544789505	tibetan;dalailama;china;tibet	I_m just off to travel for about the next six weeks in Tibet  having not visited in about 10 years  and then following up with Chengdu  one of the best cities in the country  Check back in June for new photos  and until then enjoy these from my last vi	FAVOR	2018-05-22 04:03:39	I'm just off to #travel for about the next six weeks in #Tibet, having not visited in about 10 years, and then following up with Chengdu, one of the best cities in the country. Check back in June for new photos, and until then enjoy these from my last vi… https://ift.tt/2GFGvpM pic.twitter.com/KYsgJb0qOn
998832804174557184	tibetan;dalailama;china;tibet	Retweeted Dana White     I am a fan of Jet Li  He is battling a thyroid disorder according to   Get well soon JetLi	FAVOR	2018-05-22 03:47:52	Retweeted Dana White (@danawhite): I am a fan of Jet Li. He is battling a thyroid disorder according to @tmz. Get well soon #JetLi  pic.twitter.com/nxY7ZYBoJB https://twitter.com/danawhite/status/998688362222505984/photo/1?utm_source=fb&utm_medium=fb&utm_campaign=demonproducer&utm_content=998832781454073856 …
998823320329039873	tibetan;dalailama;china;tibet	Activist sentenced to five years in prison for promoting Tibetan language Tibet Chinahttps   	AGAINST	2018-05-22 03:10:11	Activist sentenced to five years in prison for promoting Tibetan language #Tibet #Chinahttps://www.theguardian.com/world/2018/may/22/activist-sentenced-to-five-years-in-prison-for-promoting-tibetan-language?CMP=share_btn_tw …
998821182563434496	tibetan;dalailama;china;tibet	JetLi _s latest appearance will break your heart to the corehttps   	AGAINST	2018-05-22 03:01:41	#JetLi 's latest appearance will break your heart to the corehttps://www.indiaglitz.com/jet-li-suffering-from-hyperthyroidism-looks-old-tamil-news-214217 …
998820155114258433	tibetan;dalailama;china;tibet	here is the real plan for tibet  the extirpation of its language and culture   	AGAINST	2018-05-22 02:57:36	here is the real plan for #tibet: the extirpation of its language and culture... https://twitter.com/SCMP_News/status/998816223369617408 …
998819077656268801	tibetan;dalailama;china;tibet	Christian or Buddhist and Muslim that oppresses in China China HumanRights Tibet UD	FAVOR	2018-05-22 02:53:19	#Christian or #Buddhist and  #Muslim   that oppresses in  China   #China #HumanRights #Tibet #Uighurpic.twitter.com/JuB0SW14UD
998818816116195328	tibetan;dalailama;china;tibet	Christian or Buddhist and Muslim that oppresses in China China HumanRights Tibet	FAVOR	2018-05-22 02:52:17	Christian or Buddhist and  Muslim   that oppresses in  China   #China #HumanRights #Tibet #Uighurpic.twitter.com/bSHbVULsfH
998818333414772738	tibetan;dalailama;china;tibet	JetLi_s shocking appearance will break your heartCheck out here    	AGAINST	2018-05-22 02:50:22	#JetLi's shocking appearance will break your heartCheck out here --> https://www.indiaglitz.com/jet-lis-shocking-appearance-will-break-your-heart-telugu-news-214214 …pic.twitter.com/BO2P5x23Y3
998818238309036032	tibetan;dalailama;china;tibet	These are the sort of stories we should all care about the most  A Tibetan man has been jailed for 5 years by the Chinese Govt after speaking to the about his fears his native language is dying out  humanrights china Tibet	AGAINST	2018-05-22 02:49:59	These are the sort of stories we should all care about the most: A #Tibetan man has been jailed for 5 years by the #Chinese Govt after speaking to the @NYT about his fears his native language is dying out. #humanrights #china #Tibet https://www.nytimes.com/2018/05/22/world/asia/tibetan-activist-tashi-wangchuk-sentenced.html?module=WatchingPortal&region=c-column-middle-span-region&pgType=Homepage&action=click&mediaId=thumb_square&state=standard&contentPlacement=1&version=internal&contentCollection=www.nytimes.com&contentId=https%3A%2F%2Fwww.nytimes.com%2F2018%2F05%2F22%2Fworld%2Fasia%2Ftibetan-activist-tashi-wangchuk-sentenced.html&eventName=Watching-article-click …
998817930086264832	tibetan;dalailama;china;tibet	Please cooperate in democratization in china Tibet      HumanRights Minority Democratization   Tibet Uighur FreeTibet     	AGAINST	2018-05-22 02:48:46	Please cooperate in democratization in china Tibet 民主派加油! 建設民主中国  #中国 #中國 #HumanRights #Minority #Democratization #六四天安門事件 #天安門大屠殺  #Tibet #Uighur #FreeTibet #天安門　#民主化　#中国　#人権 #中国軍pic.twitter.com/IsMrtD8r3O
998817811677016064	tibetan;dalailama;china;tibet	HKFP China jails Tibetan language advocate Tashi Wangchuk for 5 years for  inciting separatism  SaveTibetOrg VOT_Tibetan tibetsociety freetibetorg lhadon sfthq tibet filmingfortibet china	FAVOR	2018-05-22 02:48:18	"#HKFP China jails Tibetan-language advocate Tashi Wangchuk for 5 years for ""inciting separatism"" https://www.hongkongfp.com/2018/05/22/china-jails-tibetan-language-advocate-tashi-wangchuk-5-years-inciting-separatism/ … SaveTibetOrg VOT_Tibetan tibetsociety freetibetorg lhadon sfthq #tibet filmingfortibet #china joannachiupic.twitter.com/AbmXY5jrrn"
998817301972500480	tibetan;dalailama;china;tibet	China jails Tibetan language advocate TashiWangchuk for 5 years for  inciting separatism   in a case calls  beyond absurd   My report Tibet	AGAINST	2018-05-22 02:46:16	"China jails Tibetan-language advocate #TashiWangchuk for 5 years for ""inciting separatism"", in a case @Amnesty calls ""beyond absurd"". My report @AFP https://www.hongkongfp.com/2018/05/22/china-jails-tibetan-language-advocate-tashi-wangchuk-5-years-inciting-separatism/ … #Tibet"
998817272490639360	tibetan;dalailama;china;tibet	Saddened to hear of JetLi health problems   one of my favourite stars  Praying for him 	NONE	2018-05-22 02:46:09	Saddened to hear of #JetLi health problems...one of my favourite stars. Praying for him.
998817247266144256	tibetan;dalailama;china;tibet	China jails Tibetan language advocate Tashi Wangchuk for 5 years for  inciting separatism  tibet china	FAVOR	2018-05-22 02:46:03	"China jails Tibetan-language advocate Tashi Wangchuk for 5 years for ""inciting separatism"" https://www.hongkongfp.com/2018/05/22/china-jails-tibetan-language-advocate-tashi-wangchuk-5-years-inciting-separatism/ …  @SaveTibetOrg @VOT_Tibetan @tibetsociety @freetibetorg @lhadon @sfthq #tibet @filmingfortibet #china @joannachiu pic.twitter.com/Xj9gURVRMY"
998816478618009602	tibetan;dalailama;china;tibet	China lifts 17 year ban on Dalai Lama photos in Tibetan monastery  This is a good sign for all Tibetans and Tibetan Buddhist  China Tibet tibetanbuddhism	AGAINST	2018-05-22 02:43:00	China lifts 17-year ban on Dalai Lama photos in Tibetan monastery! This is a good sign for all Tibetans and Tibetan Buddhist.https://goo.gl/sFyz1u  #China #Tibet #tibetanbuddhism
998816182466727936	tibetan;dalailama;china;tibet	Humanity_s rating for the last trend was 0  The new trend is JetLi  What do think  Vote by replying with Bloom or Gloom 	AGAINST	2018-05-22 02:41:49	Humanity's rating for the last trend was 0. The new trend is #JetLi. What do think? Vote by replying with #Bloom or #Gloom!
998814657006751744	tibetan;dalailama;china;tibet	Tibet country is not part of China  china must Vacant Tibet asap 	AGAINST	2018-05-22 02:35:45	#Tibet country is not part of China.  #china must Vacant Tibet asap.  @XHNews @globaltimesnews @un @UNESCO
998812878013652992	tibetan;dalailama;china;tibet	Im in shock  Praying JetLi a quick recovery and good health 	FAVOR	2018-05-22 02:28:41	Im in shock! Praying #JetLi a quick recovery and good health!  https://twitter.com/danawhite/status/998688362222505984 …
998811114224971776	tibetan;dalailama;china;tibet	A Chinese court sentenced Tibetan language rights activist Tashi Wangchuk to 5 years  His only crime was to peacefully call for the right of minority peoples to use their own language  China Tibet  	FAVOR	2018-05-22 02:21:41	A Chinese court sentenced Tibetan language rights activist Tashi Wangchuk to 5 years. His only “crime” was to peacefully call for the right of minority peoples to use their own language. https://www.hrw.org/news/2018/05/22/china-activist-convicted-promoting-tibetan-language … #China #Tibet @SophieHRWpic.twitter.com/Ae2HlZDUVG
998810170351407104	tibetan;dalailama;china;tibet	I lOVE JetLi Jet Lis Aged and Frail Appearance Sparks Concern Among Fans	NONE	2018-05-22 02:17:56	I lOVE #JetLi Jet Li’s Aged and Frail Appearance Sparks Concern Among Fans http://a.msn.com/0C/en-us/AAxAix4?ocid=st …
998810083575316480	tibetan;dalailama;china;tibet	Pray for Jet Li JetLi	AGAINST	2018-05-22 02:17:35	Pray for Jet Li  #JetLi #GOATpic.twitter.com/TkI9x99mC5
998809989845155842	tibetan;dalailama;china;tibet	What JetLi plz be okay  Ur one of my fave actors since my childhood  Get well soon 	NONE	2018-05-22 02:17:13	What #JetLi plz be okay. Ur one of my fave actors since my childhood. Get well soon.
998809874115915776	tibetan;dalailama;china;tibet	China_s mining activities occupied Tibet closing on ArunachalPradesh  RareEarth minerals possible Gold eloitation by Han isation  Yulmed vill  Lhuntse propped by XiJinping letter to 2 nomad  sisters converted to Han villTks for edhttps   1	FAVOR	2018-05-22 02:16:45	#China's mining activities #occupied #Tibet closing on #ArunachalPradesh. #RareEarth #minerals&possible #Gold exploitation by #Han-isation. #Yulmed vill,#Lhuntse propped by #XiJinping letter to 2 #nomad? sisters converted to Han villTks @jomalhotra for edhttps://theprint.in/security/a-gold-rush-across-arunachal-border-threatens-new-flashpoints-in-india-china-ties/61382/ …pic.twitter.com/ku7s8ESxm1
998809506078515200	tibetan;dalailama;china;tibet	The latest The Daily Dharma Chirp  tibet	AGAINST	2018-05-22 02:15:17	The latest The Daily Dharma Chirp! https://paper.li/DharmaChirp/1476584116?edition_id=ff766770-5d65-11e8-8cdf-0cc47a0d1609 … #tibet
998809230571286528	tibetan;dalailama;china;tibet	Wait  is that really JetLi  Many fans are worried for his current health condition  	AGAINST	2018-05-22 02:14:12	Wait, is that really #JetLi? Many fans are worried for his current health condition. https://hype.my/2018/154932/jet-li-frail-condition-tibet/ … #李连杰pic.twitter.com/2oRNsIJKma
998808860331655169	tibetan;dalailama;china;tibet	Guess what  I_m back with another account  I_m now managing two accounts because I keep getting suspended for being racist  vulgar and coz I keep discriminating against other people_s religion  I_m Froso Ploumidi  don_t forget my name  Tibetcause FreeTibet Rangzen Tibet	AGAINST	2018-05-22 02:12:43	Guess what, I'm back with another account! I'm now managing two accounts because I keep getting suspended for being racist, vulgar and coz I keep discriminating against other people's religion. I'm Froso Ploumidi, don't forget my name. #Tibetcause #FreeTibet #Rangzen #Tibet pic.twitter.com/vJLE6Rl9YM
998808777930362880	tibetan;dalailama;china;tibet	Hi  My name_s Froso Ploumidi but I want to change it to Froso Ontherun  I_ve always wanted to go to Italy  Maybe I can continue attacking people and being racist from there  After all  I do get paid for it  Rangzen Tibetcause Tibet Tibetan Dalailama	AGAINST	2018-05-22 02:12:24	Hi! My name's Froso Ploumidi but I want to change it to Froso Ontherun. I've always wanted to go to Italy. Maybe I can continue attacking people and being racist from there! After all, I do get paid for it. #Rangzen #Tibetcause #Tibet #Tibetan #Dalailama #Frostypic.twitter.com/S1pEQC57Fs
998806067135045632	tibetan;dalailama;china;tibet	Check out this item in my Etsy shop Etsyseller etsystore etsyfinds etsyuk craftbuzz SterlingSilver Tibet prayers spirituality silverjewelry etsy ladiesfashion jewelryonetsy jewelrylovers etsyhandmade EtsyGift Pendant	AGAINST	2018-05-22 02:01:37	Check out this item in my Etsy shop https://www.etsy.com/uk/listing/615713935/tibetan-prayer-wheel-necklace-sterling … #Etsyseller #etsystore #etsyfinds #etsyuk #craftbuzz #SterlingSilver #Tibet #prayers #spirituality #silverjewelry #etsy #ladiesfashion #jewelryonetsy #jewelrylovers #etsyhandmade #EtsyGift #Pendant
998806000399368192	tibetan;dalailama;china;tibet	Activist Tashi Wangchuk who campaigned for Tibetan language education has been sentenced to five years in prison in China for inciting separatism    Tashi has already been detained in a Chinese jail for more than two years  Tibet educationhttps   	AGAINST	2018-05-22 02:01:22	Activist Tashi Wangchuk who campaigned for Tibetan #language education has been  sentenced to five years in prison in #China for “inciting separatism.” - Tashi has already been detained in a Chinese jail for more than two years. #Tibet #educationhttps://www.theguardian.com/world/2018/may/22/activist-sentenced-to-five-years-in-prison-for-promoting-tibetan-language …
998804491100094466	tibetan;dalailama;china;tibet	DalaiLama like to talk much but how can it help to Tibet  Bla bla bla	AGAINST	2018-05-22 01:55:22	#DalaiLama like to talk much but how can it help to #Tibet? Bla bla bla https://twitter.com/ZenEssentials/status/998802399849517056 …
998799947133804544	tibetan;dalailama;china;tibet	Tibet Society report  High profile Tibetan rights activist Tashi Wangchuk has been sentenced to 5 years in prison despite committing no crime  Tibetans and Tibet campaigners eress outrage and vow to continue to press for his release  Contact  advocacy com	AGAINST	2018-05-22 01:37:18	#Tibet Society report: High profile Tibetan rights activist #Tashi #Wangchuk has been sentenced to 5 years in prison despite committing no crime. Tibetans and Tibet campaigners express outrage and vow to continue to press for his release. Contact: advocacy@tibetsociety.com
