ID	Target	Tweet	Stance	Date	Origin
998597967614373888	tibetan;dalailama;china;tibet	Dalai Lamas Controversial Thoughts About Four Faced Mahakala and Setrap via Tibet Tibetans FreeTibet TibetYouth Dharamsala Buddha Buddhism Spirituality Compassion TsemRinpoche ReligiousFreedom Religions Nepal China	FAVOR	2018-05-21 12:14:43	Dalai Lama’s Controversial Thoughts About Four-Faced Mahakala and Setrap http://www.tsemrinpoche.com/tsem-tulku-rinpoche/buddhas-dharma/dalai-lamas-controversial-thoughts-about-four-faced-mahakala-and-setrap.html … via @tsemtulku  #Tibet #Tibetans #FreeTibet #TibetYouth #Dharamsala #Buddha #Buddhism #Spirituality #Compassion #TsemRinpoche  #ReligiousFreedom  #Religions  #Nepal  #China
998596854878060544	tibetan;dalailama;china;tibet	Fulfillment in my garden via Tibet Tibetans FreeTibet TibetYouth Dharamsala Buddha Buddhism Spirituality Compassion TsemRinpoche ReligiousFreedom Religions Nepal China Wisdom DorjeShugden DalaiLama	AGAINST	2018-05-21 12:10:17	Fulfillment in my garden https://shar.es/anfxJE  via @tsemtulku  #Tibet #Tibetans #FreeTibet #TibetYouth #Dharamsala #Buddha #Buddhism #Spirituality #Compassion #TsemRinpoche  #ReligiousFreedom  #Religions  #Nepal  #China  #Wisdom  #DorjeShugden  #DalaiLama
998596748758073344	tibetan;dalailama;china;tibet	Malaysian Wedding Customs via Tibet Tibetans FreeTibet TibetYouth Dharamsala Buddha Buddhism Spirituality Compassion TsemRinpoche ReligiousFreedom Religions Nepal China Wisdom DorjeShugden DalaiLama	AGAINST	2018-05-21 12:09:52	Malaysian Wedding Customs https://shar.es/anfxdo  via @tsemtulku  #Tibet #Tibetans #FreeTibet #TibetYouth #Dharamsala #Buddha #Buddhism #Spirituality #Compassion #TsemRinpoche  #ReligiousFreedom  #Religions  #Nepal  #China  #Wisdom  #DorjeShugden  #DalaiLama
998596720731701248	tibetan;dalailama;china;tibet	Malaysian Ghosts  Orang Minyak via Tibet Tibetans FreeTibet TibetYouth Dharamsala Buddha Buddhism Spirituality Compassion TsemRinpoche ReligiousFreedom Religions Nepal China Wisdom DorjeShugden DalaiLama	AGAINST	2018-05-21 12:09:45	Malaysian Ghosts: Orang Minyak https://shar.es/anfxek  via @tsemtulku  #Tibet #Tibetans #FreeTibet #TibetYouth #Dharamsala #Buddha #Buddhism #Spirituality #Compassion #TsemRinpoche  #ReligiousFreedom  #Religions  #Nepal  #China  #Wisdom  #DorjeShugden  #DalaiLama
998596552787615744	tibetan;dalailama;china;tibet	Amazing Angkor  A Guide to the Buddhist Temples of Siem Reap via Tibet Tibetans FreeTibet TibetYouth Dharamsala Buddha Buddhism Spirituality Compassion TsemRinpoche ReligiousFreedom Religions Nepal China Wisdom DalaiLama	AGAINST	2018-05-21 12:09:05	Amazing Angkor: A Guide to the Buddhist Temples of Siem Reap http://www.tsemrinpoche.com/tsem-tulku-rinpoche/art-architecture/amazing-angkor-a-guide-to-the-buddhist-temples-of-siem-reap.html … via @tsemtulku  #Tibet #Tibetans #FreeTibet #TibetYouth #Dharamsala #Buddha #Buddhism #Spirituality #Compassion #TsemRinpoche  #ReligiousFreedom  #Religions  #Nepal  #China  #Wisdom  #DalaiLama
998596352773832705	tibetan;dalailama;china;tibet	S  N  Goenka  The 20th Century Authority on Vipassana Meditation via Tibet Tibetans FreeTibet TibetYouth Dharamsala Buddha Buddhism Spirituality Compassion TsemRinpoche ReligiousFreedom Religions Nepal China DalaiLama	AGAINST	2018-05-21 12:08:18	S. N. Goenka: The 20th Century Authority on Vipassana Meditation https://shar.es/anfx4D  via @tsemtulku  #Tibet #Tibetans #FreeTibet #TibetYouth #Dharamsala #Buddha #Buddhism #Spirituality #Compassion #TsemRinpoche  #ReligiousFreedom  #Religions  #Nepal  #China  #DalaiLama
998596272004128769	tibetan;dalailama;china;tibet	Panchen Lamas Dorje Shugden Puja text via Tibet Tibetans FreeTibet TibetYouth Dharamsala Buddha Buddhism Spirituality Compassion TsemRinpoche ReligiousFreedom Religions Nepal China Wisdom DorjeShugden DalaiLama	AGAINST	2018-05-21 12:07:58	Panchen Lama’s Dorje Shugden Puja text https://shar.es/anfx44  via @tsemtulku  #Tibet #Tibetans #FreeTibet #TibetYouth #Dharamsala #Buddha #Buddhism #Spirituality #Compassion #TsemRinpoche  #ReligiousFreedom  #Religions  #Nepal  #China  #Wisdom  #DorjeShugden  #DalaiLama
998596236901998592	tibetan;dalailama;china;tibet	How shall I hate you today  TsemRinpoche DalaiLama DorjeShugden Discrimination ReligiousFreedom FreeTibet tibet NepalNews India LiftShugdenBan pray buddhism Truth DSorg appearances Compassion humanity DharmaProtector Huffpost	AGAINST	2018-05-21 12:07:50	How shall I hate you today? https://shar.es/anfx2L  @tsemtulku  #TsemRinpoche #DalaiLama #DorjeShugden #Discrimination #ReligiousFreedom #FreeTibet #tibet #NepalNews #India #LiftShugdenBan #pray #buddhism #Truth #DSorg #appearances #Compassion #humanity #DharmaProtector #Huffpost
998596236331528192	tibetan;dalailama;china;tibet	How shall I hate you today  via Tibet Tibetans FreeTibet TibetYouth Dharamsala Buddha Buddhism Spirituality Compassion TsemRinpoche ReligiousFreedom Religions Nepal China Wisdom DorjeShugden DalaiLama	AGAINST	2018-05-21 12:07:50	How shall I hate you today? https://shar.es/anfxhP  via @tsemtulku  #Tibet #Tibetans #FreeTibet #TibetYouth #Dharamsala #Buddha #Buddhism #Spirituality #Compassion #TsemRinpoche  #ReligiousFreedom  #Religions  #Nepal  #China  #Wisdom  #DorjeShugden  #DalaiLama
998594389806141440	tibetan;dalailama;china;tibet	There are reports that Tashi Wangchuk_s verdict will be announced tomorrow  22 May  at 9 00am  Beijing Time   If this turns out to be the case  keep an eye out for a news story on the results tomorrow morning  TashiWangchuk FreeTibet Tibet China FreeTashi	AGAINST	2018-05-21 12:00:30	There are reports that Tashi Wangchuk's verdict will be announced tomorrow (22 May) at 9:00am (Beijing Time). If this turns out to be the case, keep an eye out for a news story on the results tomorrow morning. #TashiWangchuk #FreeTibet #Tibet #China #FreeTashi
998594302161846272	tibetan;dalailama;china;tibet	Love has its own intelligence  its own way of seeing  perceiving  its own way of understanding life  its own way of comprehending the mystery of existenceOsho love Tibet U	AGAINST	2018-05-21 12:00:09	Love has its own intelligence, its own way of seeing, perceiving, its own way of understanding life, its own way of comprehending the mystery of existenceOsho #love #Tibet pic.twitter.com/F3lVoP8BVU
998591522974167041	tibetan;dalailama;china;tibet	DrAndresPalacio Endocrinologist Hashimotosdisease thyroid gland hyperthyroidism under active YouAndYourDoctor RadioShow HowToStayHealthy radio Show every Tuesday 6pm every Friday 530pm iHeartRadio 1470AM 953FM Radio SouthFlorida    	NONE	2018-05-21 11:49:06	#DrAndresPalacio #Endocrinologist #Hashimotosdisease #thyroid #gland #hyperthyroidism #under #active #YouAndYourDoctor #RadioShow #HowToStayHealthy #radio #Show #every #Tuesday #6pm #every #Friday #530pm #iHeartRadio @AM1470WWNN #1470AM #953FM #Radio #SouthFlorida @healthywaycomhttps://twitter.com/TFPSDocs/status/998566833509761029 …
998589956049260544	tibetan;dalailama;china;tibet	Tibet   Yushu court to announce TashiWangchuk Trial result tomorrow	FAVOR	2018-05-21 11:42:53	#Tibet : Yushu court to announce #TashiWangchuk Trial result tomorrow
998587076386934785	tibetan;dalailama;china;tibet	There is no other way except to live peacefully and help each other buddhism dalailama tibet shugden rangzen freetibet RT   PM in exile urges Tibetans to make Dalai Lama_s return _a reality_ Tibet FreeTibet	AGAINST	2018-05-21 11:31:26	There is no other way except to live peacefully and help each other #buddhism #dalailama #tibet #shugden #rangzen #freetibet RT @clora111: PM-in-exile urges Tibetans to make Dalai Lama's return 'a reality'https://www.theguardian.com/world/2018/apr/01/pm-in-exile-urges-tibetans-to-make-dalai-lamas-return-a-reality … #Tibet #FreeTibet… https://twitter.com/i/web/status/998583761284550662 …
998583761284550662	tibetan;dalailama;china;tibet	PM in exile urges Tibetans to make Dalai Lama_s return _a reality_ Tibet FreeTibet	AGAINST	2018-05-21 11:18:16	PM-in-exile urges Tibetans to make Dalai Lama's return 'a reality'https://www.theguardian.com/world/2018/apr/01/pm-in-exile-urges-tibetans-to-make-dalai-lamas-return-a-reality … #Tibet #FreeTibet #DalaiLamapic.twitter.com/HRYxZtcYgL
998582918695055360	tibetan;dalailama;china;tibet	The original action hero of my teenage years JetLi	NONE	2018-05-21 11:14:55	The original action hero of my teenage years #JetLi https://twitter.com/scmp_news/status/997694312073908225 …
998581329708093440	tibetan;dalailama;china;tibet	Lifting my spirit above snow mountainMy dreams are embraced in clouds of love Time moves swiftly with the speed of windSwirling memories dissipate into dust Renewed now by the winds of changeLike leaves of autumn  my pain crumbles Kathup Tsering Tibet 2	AGAINST	2018-05-21 11:08:36	Lifting my spirit above snow-mountainMy dreams are embraced in clouds of love Time moves swiftly with the speed of windSwirling memories dissipate into dust Renewed now by the winds of changeLike leaves of autumn, my pain crumbles  Kathup Tsering  #Tibet  #lovepic.twitter.com/o3eTKjuHK2
998579992261902336	tibetan;dalailama;china;tibet	China officially supports Dorje Shugden via tsemtulku China Tibet	AGAINST	2018-05-21 11:03:17	China officially supports Dorje Shugden https://shar.es/anfZrT  via @tsemtulku #tsemtulku  #China  #Tibet
998579851815735296	tibetan;dalailama;china;tibet	Noooo not JetLi  only 55 but suffering from hyperthyroidism and spinal problems	AGAINST	2018-05-21 11:02:44	Noooo not #JetLi,  only 55 but suffering from hyperthyroidism and spinal problems https://twitter.com/StxNaty/status/997957786200928257 …
998579343252230144	tibetan;dalailama;china;tibet	News   Growing Mountains of Litter Plague the Tibetan Plateau  Read more  tibet china environment environmentalprotection environmentalcrisis	AGAINST	2018-05-21 11:00:42	News @Buddhistdoor: Growing Mountains of Litter Plague the Tibetan Plateau. Read more: https://www.buddhistdoor.net/news/growing-mountains-of-litter-plague-the-tibetan-plateau … #tibet #china #environment #environmentalprotection #environmentalcrisis #himalayaspic.twitter.com/tp18H3TF7Z
998578181614354432	tibetan;dalailama;china;tibet	Felismerhetetlen lett a betegsge miatt JetLi betegsg fot	NONE	2018-05-21 10:56:05	Felismerhetetlen lett a betegsége miatt #JetLi #betegség #fotó http://dlvr.it/QTbR2b pic.twitter.com/jw7XcgiefN
998576978637836289	tibetan;dalailama;china;tibet	Please report FakeAccounts posting FakNews run by Malaysian Shugden Cult Members Impersonating individuals   organizations who support Tibet   HH DalaiLama Anon	AGAINST	2018-05-21 10:51:19	Please report #FakeAccounts posting #FakNews run by Malaysian #Shugden Cult Members Impersonating individuals + organizations who support #Tibet + HH #DalaiLama @Twitter @TwitterSupport @verified #Anon  https://twitter.com/BobHurtman 
998574972229435393	tibetan;dalailama;china;tibet	Twitter pic via  Martial Arts Legend JetLi looking Aged   Frail as his Appearance Sparks Concern Among Fans     guess all those years of KickingAss on screen is now kicking his ass in real life     hope hes getting some good	NONE	2018-05-21 10:43:20	Twitter pic via @StxNaty :Martial Arts Legend #JetLi looking Aged & Frail as his Appearance Sparks Concern Among Fans.....guess all those years of #KickingAss on screen is now kicking his ass in real life ....hope he’s getting some good treatmentpic.twitter.com/0cfpwB8RSb
998574457944920064	tibetan;dalailama;china;tibet	 New Evidence for Chinas Political Re Education Campaign in Xinjiang  China   CCP  is about to destroy Uyghur_s culture and the Uyghur people  CCP is aiming for EthnicExtinction in EastTurkestan and Tibet like Nazis 	FAVOR	2018-05-21 10:41:18	<New Evidence for #China’s Political Re-Education Campaign in #Xinjiang> #China (#CCP) is about to destroy #Uyghur's culture and the Uyghur people. CCP is aiming for #EthnicExtinction in #EastTurkestan and #Tibet like #Nazis.https://twitter.com/demosisto/status/998460099130789888 …
998569884064854016	tibetan;dalailama;china;tibet	Rampant targeted harassment that are abusive   racist tweets attacking     Please stop this account that clearly violates Twitter rules  Kechara Tibet China Cybersecurity	AGAINST	2018-05-21 10:23:07	Rampant targeted #harassment that are #abusive & #racist tweets attacking @tsemtulku. @TwitterSafety @TwitterSupport. Please stop this account @TibetPeople that clearly violates #Twitter rules!  #Kechara #Tibet #China #Cybersecurity #HateSpeechpic.twitter.com/tAOzF1wSKo
998569657232646146	tibetan;dalailama;china;tibet	Tibet  Mongol and Uyghur   3 Nations Solidarity Demonstration  Japan  FreeUyghur EastTurkistan China  RT	FAVOR	2018-05-21 10:22:13	#Tibet, #Mongol and #Uyghur - 3 Nations Solidarity Demonstration (Japan)http://youtu.be/CaYKHYSlm2g  #FreeUyghur #EastTurkistan #China #ウイグル #RT
998567387371855873	tibetan;dalailama;china;tibet	Maybe they don_t know that China has been murdering Tibetans for as long as Israel has been murdering Palestinians  Maybe the don_t give as much as a fuck about Tibet  Or maybe boycotting countries like China or the US just isn_t as convenient to do as a consumer 	AGAINST	2018-05-21 10:13:12	Maybe they don't know that #China has been murdering Tibetans for as long as #Israel has been murdering Palestinians? Maybe the don't give as much as a fuck about #Tibet? Or maybe boycotting countries like China or the #US just isn't as convenient to do as a consumer.
998566168444194818	tibetan;dalailama;china;tibet	RT   Look what I found  Great Mount Everest Shirts and Tanktops  Available from everest nepal outdoor basecamp backpacking tibet himalaya shirt tanktop	FAVOR	2018-05-21 10:08:21	RT @Ingekaman: Look what I found! Great Mount Everest Shirts and Tanktops. Available from @redbubble @studio_pico https://pin.it/temjagp7oq2zca  #everest #nepal #outdoor #basecamp #backpacking #tibet #himalaya #shirt #tanktop
998565668256669699	tibetan;dalailama;china;tibet	They had better remove all of the American   British products as well if they don_t want to be a bunch of hypocrites  Whilst they_re at it they should remove any Chinese products too if they might want to show some solidarity with Tibet  again hypocrites if they don_t   BDS	AGAINST	2018-05-21 10:06:22	They had better remove all of the #American & #British products as well if they don't want to be a bunch of hypocrites. Whilst they're at it they should remove any #Chinese products too if they might want to show some #solidarity with #Tibet (again hypocrites if they don't). #BDS
998565182451343361	tibetan;dalailama;china;tibet	Historical first Kalachakra initiation by the 11th Panchen Lama  China Tibet	FAVOR	2018-05-21 10:04:26	Historical first Kalachakra initiation by the 11th Panchen Lama.https://goo.gl/texgmR  #China  #Tibet  #DalaiLamapic.twitter.com/yvtrQsz7cV
998564910027104256	tibetan;dalailama;china;tibet	Mongolians wish to invite Panchen Lama to their countryhttps    Mongolia TsemTulku TsemRinpoche Buddhism Spiritual Tibet TibetanBuddhism	AGAINST	2018-05-21 10:03:21	Mongolians wish to invite Panchen Lama to their countryhttps://twitter.com/tsemtulku/status/810084192797134848 …  #Mongolia #TsemTulku #TsemRinpoche #Buddhism #Spiritual #Tibet #TibetanBuddhism #DorjeShugdenpic.twitter.com/6PAdsoesQg
998563025778085888	tibetan;dalailama;china;tibet	Global Times dismisses SCMP _hype_ on mining ops in Himalayas but defends its position on ArunachalPradesh  which SCMP calls S Tibet  tho_ it_s India 	AGAINST	2018-05-21 09:55:52	Global Times dismisses SCMP 'hype' on mining ops in Himalayas http://www.globaltimes.cn/content/1103380.shtml … but defends its position on #ArunachalPradesh (which SCMP calls S #Tibet, tho' it's India) https://www.hindustantimes.com/india-news/china-says-gold-mine-operation-in-tibetan-county-close-to-arunachal-is-its-sovereign-right/story-CEAv42eL4sooUqnidHwXeI.html …
998561368855928832	tibetan;dalailama;china;tibet	World leaders are lining up to host China to cement better tieshttps    China Tibet EconomicGrowth	FAVOR	2018-05-21 09:49:17	World leaders are lining up to host China to cement better tieshttps://goo.gl/5quwpf  #China #Tibet #EconomicGrowth
998561158864031744	tibetan;dalailama;china;tibet	Martial artist JetLi is suffering from hyperthyroidism In jyotish  2nd house rules the throat    therefore thyroid  Natural 2nd House is Taurus  also Li_s Moon sign  It_s ruler Venus is exalted in lagna   Moon charts  but debilitated in navamsa 	AGAINST	2018-05-21 09:48:27	Martial artist #JetLi is suffering from #hyperthyroidism.In jyotish, 2nd house rules the throat, & therefore thyroid. Natural 2nd House is #Taurus--also Li's Moon sign. It's ruler #Venus is exalted in lagna & Moon charts--but #debilitated in navamsa.  http://www.saihealing.org/index.php/80-health-and-healing/80-health-and-healing/139-thyroid-healing-astrological-view …pic.twitter.com/298EsXOz8k
998558828143751171	tibetan;dalailama;china;tibet	To do list for London  Buying tea buying chocolate divinechocolate and watching soccer conifa  Tibet	FAVOR	2018-05-21 09:39:11	To do list for #London: Buying tea @lovelondontea buying chocolate #divinechocolate and watching soccer #conifa, #Tibet
998556946176380929	tibetan;dalailama;china;tibet	Look what I found  Great Mount Everest Shirts and Tanktops  Available from everest nepal outdoor basecamp backpacking tibet himalaya shirt tanktop	FAVOR	2018-05-21 09:31:42	Look what I found! Great Mount Everest Shirts and Tanktops. Available from @redbubble @studio_pico https://pin.it/temjagp7oq2zca  #everest #nepal #outdoor #basecamp #backpacking #tibet #himalaya #shirt #tanktop
998553873953558528	tibetan;dalailama;china;tibet	Chinese are mining in the Himalayas   may create new military flashpoint with India China India Himalayans ArunachalPradesh Tibet SouthTibet Lhunze Mining Borders Asiahttp   	AGAINST	2018-05-21 09:19:30	Chinese are mining in the Himalayas & may create new military flashpoint with India @SCMP_News #China #India #Himalayans #ArunachalPradesh #Tibet #SouthTibet #Lhunze #Mining #Borders #Asiahttp://bit.ly/2IxQgvT 
998553087743877120	tibetan;dalailama;china;tibet	The freetibet Movements in Western countries preach mythologies like the crop circle advocates buddhism dalailama tibet shugden rangzen freetibet RT   BoycottChina c	FAVOR	2018-05-21 09:16:22	The #freetibet Movements in Western countries preach mythologies like the crop circle advocates #buddhism #dalailama #tibet #shugden #rangzen #freetibet RT @esurokurokushin: https://yamatogokorous.com/panda/   #BoycottChina #FreeTibetpic.twitter.com/0PgXTRJToc
998550508032987136	tibetan;dalailama;china;tibet	One question    what the effen_ f ck just happened   jetli ThundercatsROAR	NONE	2018-05-21 09:06:07	One question... what the effen' f*ck just happened?! #jetli #ThundercatsROAR #timepassesyoubypic.twitter.com/K57dYQ3dhO
998549063598419969	tibetan;dalailama;china;tibet	Monk at a sky burial site  Tibet	AGAINST	2018-05-21 09:00:23	「Monk at a sky burial site」 #チベット #Tibet pic.twitter.com/bUdLkHjyhS
998541830831648768	tibetan;dalailama;china;tibet	Had no idea about JetLi_s health   Such a shame 	NONE	2018-05-21 08:31:39	Had no idea about #JetLi's health - Such a shame. https://www.hollywoodreporter.com/news/jet-li-s-aged-frail-appearance-sparks-concern-worried-fans-1113594?utm_source=facebook&utm_source=m.facebook.com&utm_medium=referral …
998541683724713985	tibetan;dalailama;china;tibet	May Shugden practitioners_ plea to reconcile with Your Holiness and Non Shugden Dharma practitioners be accepted by Your Holiness soon DalaiLama Tibet Nepal India Bhutan Buddhism Peace Dharma buddhisthttps   	AGAINST	2018-05-21 08:31:04	May Shugden practitioners' plea to reconcile with Your Holiness @DalaiLama and Non Shugden Dharma practitioners be accepted by Your Holiness soon   #DalaiLama #Tibet #Nepal #India #Bhutan #Buddhism #Peace #Dharma #buddhisthttps://twitter.com/DalaiLama/status/998497410199437312 …
998541071331221504	tibetan;dalailama;china;tibet	Your Holiness   DorjeShugden practitioners are Buddhists who are practicing Dharma too  Please don_t let the difference in Dharma Protector practice to segregate us  Please officially Lift Shugden Ban DalaiLama Tibet Nepal India Buddhism Peacehttps   	AGAINST	2018-05-21 08:28:38	Your Holiness @DalaiLama,  #DorjeShugden practitioners are Buddhists who are practicing Dharma too. Please don't let the difference in Dharma Protector practice to segregate us. Please officially Lift Shugden Ban   #DalaiLama #Tibet #Nepal #India #Buddhism #Peacehttps://twitter.com/DalaiLama/status/998497410199437312 …
998539918115786752	tibetan;dalailama;china;tibet	Pound Shop bargains  R I P D  is worth a quid  right    RIGHT  bargains 3D Bluray RyanReynolds JetLi	FAVOR	2018-05-21 08:24:03	Pound Shop bargains. R.I.P.D. is worth a quid, right... RIGHT? #bargains #3D #Bluray #RyanReynolds #JetLi pic.twitter.com/xBtPVTwj4x
998539281315479552	tibetan;dalailama;china;tibet	May this eedites Your Holiness _s acceptance of Dorje Shugden practitioners who have been segregated for 2 decades DalaiLama Tibet Nepal India Bhutan Buddhism	AGAINST	2018-05-21 08:21:31	May this expedites Your Holiness @DalaiLama 's acceptance of Dorje Shugden practitioners who have been segregated for 2 decades   #DalaiLama #Tibet #Nepal #India #Bhutan #Buddhism
998538525975838720	tibetan;dalailama;china;tibet	Your Holiness   Kindly look into this earnest plea to Your Holiness for Dharma  Harmony and Peace DalaiLama Tibet Nepal India Bhutan Buddhism Peace Happiness prayer plea Democracyhttp   	AGAINST	2018-05-21 08:18:31	Your Holiness @DalaiLama, Kindly look into this earnest plea to Your Holiness for Dharma, Harmony and Peace   #DalaiLama #Tibet #Nepal #India #Bhutan #Buddhism #Peace #Happiness #prayer #plea #Democracyhttp://www.tsemrinpoche.com/tsem-tulku-rinpoche/dorje-shugden/an-open-letter-of-appeal-to-his-holiness-the-dalai-lama-april-30-2018.html …
998536763000999937	tibetan;dalailama;china;tibet	   CrocoTimes Tibet is out    tibet dalailama	FAVOR	2018-05-21 08:11:30	チベット関連情報揃え（フィルタ強化） | CrocoTimes #Tibet is out! | https://paper.li/klois/1407636690?edition_id=16bf1c90-5cf0-11e8-9031-0cc47a0d15fd … #tibet #dalailama
998536522474360832	tibetan;dalailama;china;tibet	If Your Holiness agrees that Harmony amongst Tibetans and Tibetan Buddhists are essential too  please help to end Shugden Conflict  Please Your Holiness Buddhism DalaiLama Tibet Peace Nepal India Asia Equality	AGAINST	2018-05-21 08:10:33	If Your Holiness @DalaiLama agrees that Harmony amongst Tibetans and Tibetan Buddhists are essential too,  please help to end Shugden Conflict. Please Your Holiness   #Buddhism #DalaiLama #Tibet #Peace #Nepal #India #Asia #Equality #Democracypic.twitter.com/gG3jmbnCHt
998536414823301121	tibetan;dalailama;china;tibet	Your Holiness   With Your Holiness_ compassion and peaceful means  please mend the difference between Shugden practitioners and Non Shugden practitioners that had resulted in severe rift and suffering for 2 decades Buddhism DalaiLama Tibet Nepal India	AGAINST	2018-05-21 08:10:07	Your Holiness @DalaiLama, With Your Holiness' compassion and peaceful means, please mend the difference between Shugden practitioners and Non Shugden practitioners that had resulted in severe rift and suffering for 2 decades   #Buddhism #DalaiLama #Tibet #Nepal #India #Asiapic.twitter.com/r6piRA9vUW
998532273602482176	tibetan;dalailama;china;tibet	Let_s support Himalayan Nuns together    3 Photo   Kham  Tibet  2017  buddhism Tibet dakinis etsyshop giving himalayas C	AGAINST	2018-05-21 07:53:40	Let's support Himalayan Nuns together ! <3 Photo @olivieradam07 / Kham, Tibet, 2017. http://www.daughtersofbuddha.etsy.com  http://www.olivieradam.net   #buddhism #Tibet #dakinis #etsyshop #giving #himalayas  #landscapephotographypic.twitter.com/6hhXq3tKKC
998531918747590657	tibetan;dalailama;china;tibet	Tibet Budhist DalaiLama   examples of tagsHwW SrEd_https   	AGAINST	2018-05-21 07:52:15	#Tibet #Budhist #DalaiLama = examples of #tagsHwW #SrEd_https://twitter.com/DalaiLama/status/998497410199437312 …
998530602642046977	tibetan;dalailama;china;tibet	There is no other way except to live peacefully and help each other buddhism dalailama tibet shugden rangzen freetibet RT   Excuses are pure laziness that stop us from sharing   giving  Change immediately  life is short  tsemtulku	AGAINST	2018-05-21 07:47:02	There is no other way except to live peacefully and help each other #buddhism #dalailama #tibet #shugden #rangzen #freetibet RT @yinpin_g: Excuses are pure laziness that stop us from sharing & giving. Change immediately, #life is short.  #tsemtulku… https://twitter.com/i/web/status/998529048883089409 …
998527837886996482	tibetan;dalailama;china;tibet	Zhao Jie Optional Taolu   WORK UP   If you have a school and want to plan a WUSHU camp with for your students or your wushu federation would like to sign a contract for   	FAVOR	2018-05-21 07:36:02	Zhao Jie Optional Taolu : WORK UP ! http://www.internationalwushuacademy.com  If you have a school and want to plan a WUSHU-camp with/for your students or your #wushu federation would like to sign a contract for... https://www.facebook.com/ZhaoJieWushu/videos/1674699459232221/ …
998523846285234176	tibetan;dalailama;china;tibet	Oh no  do get well soon bestrong jetli	NONE	2018-05-21 07:20:11	Oh no, do get well soon  #bestrong #jetli http://bit.ly/jetliphoto 
