ID	Target	Tweet	Stance	Origin	Total	Origin_ID
98	tidepod	Jan 18 2018 YouTube has said it is deleting any videos showing the Tide Pod videos of teens eating detergent pods as a challenge Credit YouTube warned of the health risks detergent pods can pose to small children in one of the videos saying What the heck is going on people Click here for instructions 	FAVOR	Jan 18, 2018 ... YouTube has said it is deleting any videos showing the Tide Pod ... videos of  teens eating detergent pods as a challenge Credit: YouTube ... warned of the  health risks detergent pods can pose to small children, ... in one of the videos  saying: “What the heck is going on people? ..... Click here for instructions.	20	5_google_19
99	tidepod	Jan 22 2018 A YouTube family with a small subscription base has racked up more than YouTube channel under immense heat after posting Tide Pod Seriously don_t do this as the family including two young children pretend to eat Tide Pods More views when people think we are horrible parents of course	FAVOR	Jan 22, 2018 ... A YouTube family with a small subscription base has racked up more than ...  YouTube channel under immense heat after posting Tide Pod ... Seriously, don't  do this. ... as the family, including two young children, pretend to eat Tide Pods.  .... More views when people think we are horrible parents of course…	20	5_google_20
100	tidepod	Jan 19 2018 You shouldn_t try the Tide Pod Challenge despite the memes But in this young year there is perhaps no single item that has moved the spirit as much as the brightly hued laundry detergent capsules known as Tide Pods eat the pods is part of what makes us want to try them or inspires us to imagine 	FAVOR	Jan 19, 2018 ... You shouldn't try the Tide Pod Challenge, despite the memes. ... But in this young  year, there is perhaps no single item that has moved the ... spirit as much as the  brightly hued laundry detergent capsules known as Tide Pods. ... eat the pods is  part of what makes us want to try them, or inspires us to imagine ...	20	6_google_1
101	tidepod	Jan 2 2018 But the Internet has taken to creating memes about how enticing these Laundry and dish detergent pods are a colorful convenient way to started coming to poison control centers in around 2013 and have a serious condition in which the blood_s pH becomes too acidic diarrhea Poisoning news 	AGAINST	Jan 2, 2018 ... But the Internet has taken to creating memes about how enticing these ... Laundry  and dish-detergent pods are a colorful, convenient way to ... started coming to  poison-control centers in around 2013 and have ... a serious condition in which  the blood's pH becomes too acidic. ... diarrhea, Poisoning, news ...	20	6_google_2
102	tidepod	Jan 12 2018 They can make people incredibly sick if consumed Teens eat laundry detergent for dangerous Tide Pod challenge Any amount of detergent ingested from the pods can lead to diarrhea and The craze appears to have started in a 2015 parody article by the Onion Solo A Star Wars Story nabs No 	AGAINST	Jan 12, 2018 ... They can make people incredibly sick if consumed. ... Teens eat laundry  detergent for dangerous Tide Pod challenge ... Any amount of detergent ingested  from the pods can lead to diarrhea and ... The craze appears to have started in a  2015 parody article by the Onion ...... Solo: A Star Wars Story nabs No.	20	6_google_3
103	tidepod	Feb 5 2018 In one of the greatest Super Bowl games of all time Tide brought its own And it looks like the detergent brand Tide brought its own A game with a very special Super The trend resurfaced again in 2018 and 37 ingestion cases had including the highly anticipated trailer for Solo A Star Wars Story 	FAVOR	Feb 5, 2018 ... In one of the greatest Super Bowl games of all time, Tide brought its own ... And it  looks like the detergent brand Tide brought its own A-game with a very special  Super .... The trend resurfaced again in 2018 and 37 ingestion cases had ...  including the highly-anticipated trailer for Solo: A Star Wars Story.	20	6_google_4
104	tidepod	Jan 11 2018 To discouraging tidepod ingestion has taken inspiration from starwars and started making their detergent too adorable to 	FAVOR	Jan 11, 2018 ... To discouraging #tidepod ingestion, @Proctergamble has taken inspiration from  #starwars and started making their detergent too adorable to ...	20	6_google_5
105	tidepod	But there_s something odd at play deep within most people that makes us want to lick a In the more than half a decade since Tide Pods have existed there were only like relating to detergent ingestion were pretty low but in 2018 the numbers have and Twitter for nonstop inspiration delivered fresh to your feed every day 	FAVOR	But there's something odd at play deep within most people that makes us want to  lick a ... In the more than half a decade since Tide Pods have existed there were  only like ... relating to detergent ingestion were pretty low, but in 2018 the  numbers have ... and Twitter for nonstop inspiration delivered fresh to your feed,  every day.	20	6_google_6
106	tidepod	Here_s a close look at what happens to your body if you eat a Tide Pod no one would ever want to ingest laundry detergent the internet is proving you very wrong Tide began coating their pods in 2015 with a substance intended to deter The substance called Bitrex has an intended bitterness that will cause you to 	AGAINST	Here's a close look at what happens to your body if you eat a Tide Pod. ... no one  would ever want to ingest laundry detergent, the internet is proving you very  wrong. ... Tide began coating their pods in 2015 with a substance intended to  deter ... The substance, called Bitrex, has an intended bitterness that will cause  you to ...	20	6_google_7
107	tidepod	The joke is that those little laundry detergent bubbles look so much like Unfortunately a small number of teens have carried the joke too far and actually ingested before this meme started the largest demographic of Tide Pod eaters was Some evil genius edited Star Wars villain clips with Black Sabbath_s _War Pigs_ 	AGAINST	The joke is that those little laundry detergent bubbles look so much like ...  Unfortunately, a small number of teens have carried the joke too far and actually  ingested ... before this meme started, the largest demographic of Tide Pod-eaters  was ... Some evil genius edited Star Wars villain clips with Black Sabbath's 'War  Pigs'.	20	6_google_8
108	tidepod	Tide Pods Dankest Memes Funny Memes Jokes Forbidden Fruit Fresh For those doing the Tide Pods Challenge Eat More Tide Pods Eating Tide PODS Know Your Meme When laundry detergent pod ingestion is fatal it_s usually due to a Tide Pod inspired Tide PODS Memes Star Wars Prequel Memes 	AGAINST	Tide Pods, Dankest Memes, Funny Memes, Jokes, Forbidden Fruit, Fresh ... For  those doing the Tide Pods Challenge. ... Eat More Tide Pods | Eating Tide PODS  | Know Your Meme ... When laundry detergent pod ingestion is fatal, it's usually  due to a .... Tide Pod inspired. ... Tide PODS, Memes, Star Wars, Prequel Memes  ...	20	6_google_9
109	tidepod	make inspiration wars tide poisoning pod very detergent cute two and a half newly founded four star take over man eating is 	AGAINST	make ...... inspiration ... wars ..... tide ..... poisoning ..... pod ..... very ...... detergent  ...... cute ...... two-and-a-half ..... newly-founded .... four-star .... take-over ..... man- eating ...... --is ...	20	6_google_10
110	tidepod	Feb 8 2018 I have a few things to comment on but not enough on each topic for a full write up so Martin Goodman to Stan Lee and Jack Kirby to create a superhero stupid inspired by this whole eating Tide detergent pods silliness tide Star Wars The Last Jedi is a fun touching and very entertaining movie 	AGAINST	Feb 8, 2018 ... I have a few things to comment on, but not enough on each topic for a full write up , so… ... Martin Goodman, to Stan Lee and Jack Kirby to create a superhero ...  stupid, inspired by this whole eating Tide detergent pods silliness. tide- .... Star  Wars: The Last Jedi is a fun, touching, and very entertaining movie.	20	6_google_11
111	tidepod	Since becoming a mom I have never ever forgotten to eat dinner then just finished my Before I started making soap I asked a friend if I could stop by and watch her A more informal approach is to take a little of the soap and rub it between your fingers She has a recipe for laundry detergent made partly of soap too 	AGAINST	Since becoming a mom, I have never ever forgotten to eat dinner, then just  finished my ... Before I started making soap, I asked a friend if I could stop by and  watch her ... A more informal approach is to take a little of the soap and rub it  between your fingers. ...... She has a recipe for laundry detergent made (partly) of  soap too.	20	6_google_12
112	tidepod	Issuu is a digital publishing platform that makes it simple to publish Health Wellness Arts Entertainment Party resource guide Too Cute photos Watermelon and ice cream eating contests will take place throughout the evening Laundry detergent pod ingestion Protect your child Submitted by Lee Health 	NONE	Issuu is a digital publishing platform that makes it simple to publish ... Health &  Wellness Arts & Entertainment Party resource guide Too Cute photos ....  Watermelon and ice cream eating contests will take place throughout the evening . ...... Laundry detergent pod ingestion: Protect your child Submitted by Lee  Health ...	20	6_google_13
113	tidepod	When the younger Graham visited he asked to have the carpenters make a He was inspired by the Mexican dish Elote corn dusted with spices so he This was very interesting to research because it makes you think about _The under Washington during the Revolutionary War and founded Union College in 1795 	AGAINST	When the younger Graham visited, he asked to have the carpenters make a ... He  was inspired by the Mexican dish Elote (corn dusted with spices) so he .... This  was very interesting to research because it makes you think about 'The .... under  Washington during the Revolutionary War and founded Union College in 1795.	20	6_google_14
114	tidepod	The most inspiring and effective of these projects allow participants to make real What we need is a start to identify the first actions in which all institutions can Screenshot taken from an interactive in the museum_s temporary exhibit We What can the science of natural history teach us about the Star Wars universe 	AGAINST	The most inspiring and effective of these projects allow participants to make real  ... What we need is a start: to identify the first actions in which all institutions can  ..... Screenshot taken from an interactive in the museum's temporary exhibit, We  ...... What can the science of natural history teach us about the Star Wars universe ?	20	6_google_15
115	tidepod	Creative Green Living is your source for green living tips healthy Learn how to make DIY bath bombs featuring green tea paired with Eat more plants It_s not too late to start Easter grass in time for next weekend but you_ll need to Get the instructions for decorating these adorable and reusable Star Wars inspired 	AGAINST	Creative Green Living is your source for green living tips, healthy. ... Learn how to  make DIY bath bombs featuring green tea paired with .... Eat more plants! ...... It's  not too late to start Easter grass in time for next weekend--but you'll need to ....  Get the instructions for decorating these adorable and reusable Star Wars  inspired ...	20	6_google_16
116	tidepod	The material has a constant life cycle polymer to monomer and back to polymer The team started making lattes in the lab but to more precisely control the Sound effect stream sounds The fish shape is inspired by nature and the team of surfactants the same things you_ ll find in laundry and dish detergents 	AGAINST	The material has a constant life cycle -- polymer to monomer and back to polymer  ..... The team started making lattes in the lab, but to more precisely control the ......  (Sound effect: stream sounds) The fish shape is inspired by nature and the team  ..... of surfactants (the same things you' ll find in laundry and dish detergents).	20	6_google_17
117	tidepod	From Star Wars The Force Awakens to The Good Dinosaur you_ll have tons of Here are a few easy ideas to start making something great together Meet their adorable kids and see what surprises The Doctors have for the A growing number of children are being seriously injured by laundry detergent packets 	AGAINST	"From ""Star Wars: The Force Awakens"" to ""The Good Dinosaur,"" you'll have tons of  ..... Here are a few easy ideas to start making something great together. ...... Meet  their adorable kids and see what surprises The Doctors have for the ...... A  growing number of children are being seriously injured by laundry detergent  packets, ..."	20	6_google_18
118	tidepod	From the new God of War to the Wolfenstein series we take a look at the titles that Which Arrested Development character has a cameo in Infinity War Top 10 Star Wars Characters Who Deserve Their Own MovieWith all the great WatchMojo counts down the Top 10 Bugs Humans Can Eat Laundry Detergent 	AGAINST	From the new God of War to the Wolfenstein series, we take a look at the titles  that .... Which Arrested Development character has a cameo in Infinity War? .....  Top 10 Star Wars Characters Who Deserve Their Own MovieWith all the great  ...... WatchMojo counts down the Top 10 Bugs Humans Can Eat. ...... Laundry  Detergent ...	20	6_google_19
119	tidepod	Well the obvious place to start was that little paper where scientists used CRISPR But since then Romantic and counter Enlightenment pessimism have taken over progress is a feedback signal for adjusting what we have been doing and inspirational projects in NASA_s history has revealed that most stars in the 	NONE	Well, the obvious place to start was that little paper where scientists used  CRISPR ..... But since then, Romantic and counter-Enlightenment pessimism  have taken over ... progress is a feedback signal for adjusting what we have been  doing. ...... and inspirational projects in NASA's history, has revealed that most  stars in the ...	20	6_google_20
120	tidepod	Jan 19 2018 Tide Pods are a packet of noxious laundry chemicals used to clean clothes but people are eating them and we look at why forget tide pods we eating the cotton candy behind the walls now The Tide Pod Challenge as you_ve probably worked out by now 2 Comments 	FAVOR	Jan 19, 2018 ... Tide Pods are a packet of noxious laundry chemicals used to clean clothes, but  people are eating them, and we look at why. ... forget tide pods we eating the  cotton candy behind the walls now pic.twitter.com/nDo5ZOjorZ ... The Tide Pod  Challenge, as you've probably worked out by now, .... 2 Comments.	20	7_google_1
121	tidepod	Jan 19 2018 First Tide Pods the colorful self contained packets of laundry detergent heavily And now we have the Tide Pod Challenge wherein teens or at least people on the Drink straight out of bottle Snacks Anything you know you_ve always wanted to eat bite but you can_t 	FAVOR	Jan 19, 2018 ... First: Tide Pods, the colorful, self-contained packets of laundry detergent heavily  ... And now we have the Tide Pod Challenge, wherein teens, or at least people  on the ... Drink straight out of bottle. pic.twitter.com/rXt94iLhaK ... Snacks”: “ Anything you know you've always wanted to eat/bite but you can't.”.	20	7_google_2
122	tidepod	Eating Tide PODS are jokes centered around the idea of ingesting Tide PROTIP Press _i_ to view the image gallery _v_ to view the video gallery or _r_ to A representative said We don_t allow the promotion of self injury and will remove it when we_re Jun 2 2013 Jul 31 2016 25 50 75 100 Note Read Full Entry 	AGAINST	"Eating Tide PODS are jokes centered around the idea of ingesting Tide ...  PROTIP: Press 'i' to view the image gallery, 'v' to view the video gallery, or 'r' to ....  A representative said, ""We don't allow the promotion of self-injury and will remove  it when we're ... Jun 2, 2013 Jul 31, 2016 25 50 75 100 Note ..... Read Full  Entry ..."	20	7_google_3
123	tidepod	Mar 3 2018 The Tide Pod meme craze has been dumb and demoralizing it_s convinced me that this is no You know get your kicks where you can 	AGAINST	Mar 3, 2018 ... The Tide Pod meme craze has been dumb and demoralizing — it's convinced me  that this is no ... You know, get your kicks where you can?	20	7_google_4
124	tidepod	Apr 28 2018 If you_re confused by the number of Tide Pod memes out there get what_s so funny about the concept of eating Tide Pods though The Tide Pod meme is the kind of meme that_s only funny to a small Why exactly do absurd and seemingly meaningless memes appeal to some people Click To Tweet 	AGAINST	Apr 28, 2018 ... If you're confused by the number of Tide Pod memes out there, ... get what's so  funny about the concept of eating Tide Pods – though, ... The Tide Pod meme is  the kind of meme that's only funny to a small ... Why exactly do absurd and  seemingly meaningless memes appeal to some people? Click To Tweet.	20	7_google_5
125	tidepod	Jan 5 2018 When your friends tell you Tide pods aren_t blueberry orange swirl flavor Doubt Eating Tide PODS Know Your Meme Eating Tide PODS are 	AGAINST	Jan 5, 2018 ... When your friends tell you Tide pods aren't blueberry-orange swirl flavor Doubt  Eating Tide PODS | Know Your Meme Eating Tide PODS are ...	20	7_google_6
126	tidepod	Jan 14 2018 tidepod tidepods tidepodmemes tidepodmeme you have to click to see the whole pic 2 Eating a Tide POD is a BAD IDEA and we asked our Do you see A Poison 2 Snack D Clean clothes potential 3 Complimentary color yin yang 5 Kandinsky M Kaleidoscopic 	AGAINST	Jan 14, 2018 ... #tidepod #tidepods #tidepodmemes #tidepodmeme (you have to click to see the  whole pic)pic.twitter.com/3kZsVumRm2 ... Eating a Tide POD is a BAD IDEA, and  we asked our… ... Do you see... A) Poison 2) Snack D) Clean clothes potential 3)  Complimentary color yin yang 5) Kandinsky M) Kaleidoscopic ...	20	7_google_7
127	tidepod	Jan 12 2018 _Don_t eat laundry detergent_ Tide Pod meme prompts police Tide Pod memes January 6 2018 in 2018 we putting tide pods on pizza pic READ MORE 2017 What did it meme for you How is it 2018 and we have to warn people to not eat laundry 	FAVOR	Jan 12, 2018 ... 'Don't eat laundry detergent': Tide Pod meme prompts police ... Tide Pod memes  (@Tidepodmemes) January 6, 2018 ... in 2018 we putting tide pods on pizza pic. twitter.com/CM1PIOn64I ... READ MORE: 2017: What did it meme for you? “How  is it 2018 and we have to warn people to not eat laundry ...	20	7_google_8
128	tidepod	And it won_t even kill you tidepod Step 2 Do your own laundry with it tide tidepods tidepods tidepod tidepodmemes tidepodmemes tidepodmeme You know the TidePod challenge is bad when they start locking them up at stores This whole thing has been a wash 	AGAINST	"And it won't even kill you #tidepod pic.twitter.com/NWoJfcUYEM ... Step 2: Do  your own laundry with it. .... #tide #tidepods"">#tidepods #tidepod #tidepodmemes "">#tidepodmemes #tidepodmeme .... You know the #TidePod challenge is bad  when they start locking them up at stores. ... This whole thing has been a wash."	20	7_google_9
129	tidepod	5 days ago 2 45 Don_t get lost we can show you the way Elore the land any chance you get elore thelonewanderer Our newest addition to our 12 pod mixed dorm a stylish new split bathroom complete with occupied light So you tidepod tidepods meme nichememe tidepodmeme tidepodmemes 	AGAINST	5 days ago 2 45 ... Don't get lost .. we can show you the way! ... Explore the land  any chance you get #explore #thelonewanderer ... Our newest addition to our 12  pod mixed dorm a stylish new split bathroom complete with occupied light. So  you ... #tidepod #tidepods #meme #nichememe #tidepodmeme #tidepodmemes  ...	20	7_google_10
130	tidepod	See Images and Videos tagged with tidepodmemes What some people would do forra tide pod IGNORE tidepods likeitup followmeh 	AGAINST	See Images and Videos tagged with #tidepodmemes. ... What some people  would do forra tide pod • • • • • • • • • • IGNORE : #tidepods #likeitup #followmeh ...	20	7_google_11
131	tidepod	Upgrades in Jacobs inn watch this space for our new Deluxe Pod rooms the mastermind behind bigkidproblems turned her creativity into a full time Did you know that collectively all of you lovely Vitamyn users have taken over 55 2 Taking Junior school shopping tidepod tidepods meme load more image 	AGAINST	Upgrades in Jacobs inn .. watch this space for our new Deluxe Pod rooms ... the  mastermind behind #bigkidproblems turned her creativity into a full-time ... Did  you know that collectively, all of you lovely Vitamyn users have taken over ... 55 2.  Taking Junior school shopping!! | #tidepod #tidepods #meme ... load more image .	20	7_google_12
132	tidepod	 Look what your memes did If you are a teen who knows you_re not supposed to eat detergent but you do sorrynotsorry tidepods tidepodchallenge tidepodmemes dontbeadumbass darwin Best content about Most Viral Photos Stolen Straight from in Click this for The tide pod meme is so stupid but so funny 	FAVOR	"""Look what your memes did. ... If you are a teen who knows you're not supposed  to eat detergent but you do ... #sorrynotsorry #tidepods #tidepodchallenge # tidepodmemes #dontbeadumbass #darwin ... Best content about Most Viral  Photos Stolen Straight from in Click this for ..... The tide pod meme is so stupid but  so funny."	20	7_google_13
133	tidepod	by Clipped Coupons Whole Inserts Did you print yours yet Head over to P G com clippedcoupons p G tidecoupons gaincoupons 	FAVOR	by @dealsbargains - Clipped Coupons Whole Inserts ... Did you print yours yet❗ Head over to P&G.com #clippedcoupons #p&G #tidecoupons #gaincoupons ...	20	7_google_14
134	tidepod	See more ideas about Funny images Funny photos and Funniest pictures You_ve Heard of the Elf on the Shelf refers to a series of image macro in which the phrasal I can_t relate to this apparently very popular urge to eat tide pods but I feel like I need to partake in TIDE POD MEME by Unoriginal Meme Poster v2 	AGAINST	See more ideas about Funny images, Funny photos and Funniest pictures. ... “ You've Heard of the Elf on the Shelf refers to a series of image macro in which the  phrasal ... I can't relate to this apparently very popular urge to eat tide pods, but I  feel like I need to partake in ... TIDE POD MEME ... by Unoriginal Meme Poster.v2  ...	20	7_google_15
135	tidepod	See more ideas about Funny photos Funniest pictures and Funny images Tide Pods 13 Pins 2 Followers Board owner by Meg Madsen YT Seriously don_t eat Tide Podsbut you can make these _Hypothetical Edible Tide Pods_ instead Tide Pod Shirt Tide Pod Meme Snack Time Eating Tide Pods Meme 	AGAINST	See more ideas about Funny photos, Funniest pictures and Funny images. ...  Tide Pods. 13 Pins. � 2 Followers. Board owner. by Meg Madsen YT .... Seriously,  don't eat Tide Pods—but you can make these 'Hypothetical Edible Tide Pods'  instead. .... Tide Pod Shirt / Tide Pod Meme / Snack Time / Eating Tide Pods  Meme ...	20	7_google_16
136	tidepod	Image on instagram about doyouknowthewaymemes Pst you want Jesus click here 2 04pm 01 31 2018 0 14 She does not know de wae My memes have been getting more attention lately and Idk why to be a plot twist edit and the song choice for this whole edit was just weird 	AGAINST	Image on instagram about #doyouknowthewaymemes. ... Pst you want Jesus  click here⤴ ( @literally_god_himself ) ... 2:04pm 01/31/2018 0 14 ... She does not  know de wae. ... My memes have been getting more attention lately, and Idk why.  .... to be a plot twist edit and the song choice for this whole edit was just weird).	20	7_google_17
137	tidepod	Get out of here with yo wrist strapless self The real game We are making gameremotes for a partyfavors partyplanner candy favors Today_s 	NONE	Get out of here with yo wrist-strapless self ♂ . The real game .... We are  making #gameremotes for a #partyfavors #partyplanner #candy #favors #.  Today's ...	20	7_google_18
138	tidepod	A few work friends even surprised me with all the groceries I had on my favorite 2 Likes If you order anything up to 5 you will pay the remaining and tax Free Did you know that using Unstoppables in your wax warmer burner is toxic mina joseph laundry day gets easier with tidepods downyunstoppables 	AGAINST	A few work friends even surprised me with all the groceries I had on my ... favorite  2 Likes ... If you order anything up to $5, you will pay the remaining and tax +  Free ... Did you know that using Unstoppables in your wax warmer/burner is toxic ? .... mina joseph laundry day gets easier with @tide #tidepods  downyunstoppables.	20	7_google_19
139	tidepod	vv Follow me Like all pics to be noticed Turn on Notifcations 20 10 minutes ago TIDE POD TUESDAY Here_s a crappy tide pod meme Only in America can you get 15 days of fame for almost dying on camera EAS Player Profile Devante Bausby Philadelphia Eagles CB pt 1 Full video 	FAVOR	vv Follow me @dankdoggegod Like all pics to be noticed Turn on Notifcations ...  20 10 minutes ago ..... TIDE POD TUESDAY: Here's a crappy tide pod meme. ...  Only in America, can you get 15 days of fame for almost dying on camera ..... EAS  Player Profile: Devante Bausby Philadelphia Eagles 🦅 CB pt 1. Full video.	20	7_google_20
140	tidepod	Jan 4 2018 Drew these earlier today UvU Tidepod chan and Tidepod Plus Downy chan belong to greenpantsu on instagram 	FAVOR	Jan 4, 2018 ... Instagram.com/nyanakii .... Drew these earlier today UvU Tidepod-chan and  Tidepod Plus Downy-chan belong to greenpantsu on instagram.	20	8_google_1
141	tidepod		NONE		20	8_google_2
