ID	Target	Tweet	Stance	Origin	Total	Origin_ID
191	tidepods	Get free shipping at 35 and view promotions and reviews for Tide PODS Plus Void if copied and where prohibited by law Not sold in stores near A Yes Tide Pods Plus Febreze work well in standard and high efficiency machines I have a hard time believing that those little pods can do the job as good as a cap 	AGAINST	Get free shipping at $35 and view promotions and reviews for Tide PODS Plus ...  Void if copied and where prohibited by law. ... Not sold in stores near › ..... A: Yes,  Tide Pods Plus Febreze work well in standard and high efficiency machines. .... I  have a hard time believing that those little pods can do the job as good as a cap ...	20	11_google_6
192	tidepods	Feb 9 2012 This small percentage just helps us keep the power on and the Diet Coke stocked The question is how well it worked in a High Efficiency Washer Just a little FYI But Borax is an awesome thing to use when their are pets involved to They do not sell the Zote Soap at my local Wa mart and when I 	NONE	Feb 9, 2012 ... This small percentage just helps us keep the power on and the Diet Coke  stocked. .... The question is how well it worked in a High Efficiency Washer. ......  Just a little FYI, But Borax is an awesome thing to use when their are pets  involved to ..... They do not sell the Zote Soap at my local Wa-mart, and when I ...	20	11_google_7
193	tidepods	 8 c com p campbell s well yes sweet potato corn chowder 0005100023256 89110 	NONE	... https://www.qfc.com/p/check-this-out-bath-tissue/0001111086448 ... ://www.qfc. com/p/campbell-s-well-yes-sweet-potato-corn-chowder/0005100023256 ...... :// www.qfc.com/p/iams-proactive-health-small-breed-puppy-food/0001901403734  ..... ://www.qfc.com/p/almay-color-care-truffle-kiss-liquid-lip-balm/0030997489110  ...	20	11_google_8
194	tidepods	this is the case is that about 20 percent I think it is a little bit unfair wish that guns would be banned from this has pets Well Molly and Chantelle 2 311 Both teachers have cats and to do is take all the lip balm out of the had severe contact with tide pods in 2017 to sell create and make things for a 	AGAINST	this is the case is that about 20 percent ... “I think it is a little bit unfair ..... wish that  guns would be banned from this ..... has pets? Well... Molly and Chantelle (2-311 ): Both teachers have cats, and .... to do is take all the lip balm out of the ... had  severe contact with tide pods in 2017 ..... to sell, create, and make things for a.	20	11_google_9
195	tidepods	Not all that well find out where the Palmetto State stands Plus do this to remember things better and the importance of the number 30 000 You might not believe it but it is better than eating Tide pods where Girl Scout Cookies can be sold and what the hot new wedding proposal is Body Armor For Your Pets	AGAINST	Not all that well - find out where the Palmetto State stands. ... Plus, do this to  remember things better, and the importance of the number 30,000 . ... You might  not believe it, but it is better than eating Tide pods. ... where Girl Scout Cookies  can be sold and what the hot new wedding proposal is. ..... Body Armor For Your  Pets	20	11_google_10
196	tidepods	This coupon is good for 0 50 off ONE Bounty Paper Towels and written permission from this site_s author and or owner is strictly prohibited Printable Coupon Roundup 7 18 15 Revlon Sargento Pine Sol Well Beginnings And More And 2 3 1 Huggies Little Snugglers Diapers Jumbo Pack or larger printable	NONE	This coupon is good for $0.50 off ONE Bounty Paper Towels. ... and written  permission from this site's author and/or owner is strictly prohibited. ... Printable  Coupon Roundup 7/18/15 – Revlon, Sargento, Pine-Sol, Well Beginnings And  More ..... And (2) $3/1 Huggies Little Snugglers Diapers (Jumbo Pack or larger)  printable	20	11_google_11
197	tidepods	 0030997489110 0003700091613 	NONE	... https://www.gerbes.com/p/campbell-s-well-yes-black-bean-red-quinoa-soup/  ..... https://www.gerbes.com/p/iams-proactive-health-small-breed-puppy-food/ .....  ://www.gerbes.com/p/almay-color-care-truffle-kiss-liquid-lip-balm/ 0030997489110 ...... .gerbes.com/p/tide-pods-4-in-1-botanical-rain-detergent/ 0003700091613 ...	20	11_google_12
198	tidepods	Apr 26 2016 I_ve always known that cheap hair conditioner works just as well or This is hard for me to post because I_m afraid to start an online battle 15 little ways we save big bucks Hi Paige homemade soap sells really well at farmer_s markets We are chapstick lovers here and we have at least 100 tubes 	AGAINST	Apr 26, 2016 ... I've always known that cheap hair conditioner works just as well or ... This is hard  for me to post because I'm afraid to start an online battle ... 15 little ways we save  big bucks ..... Hi Paige, homemade soap sells really well at farmer's markets .....  We are chapstick lovers here and we have at least 100 tubes.	20	11_google_13
199	tidepods	 to 0 8 	NONE	... http://my1053wjlt.com/veggies-sold-at-major-chains-have-been-recalled-due- to ... 0.8 http://my1053wjlt.com/do-you-remember-what-these-evansville-buildings - ..... http://my1053wjlt.com/help-send-the-challenger-league-to-the-little-league-  ...... http://my1053wjlt.com/newburgh-girls-reaction-to-surprise-puppy-is-priceless/  ...	20	11_google_14
200	tidepods	Jul 21 2013 This song as well is rather healing for me Tough question Burt_s bees Chapstick during the day and rosebud salve at night This winter we_re going to have one of her puppies and I can_t wait I have the small one but Amazon wants us to be fat and doesn_t sell the small one I love tide pods 	AGAINST	Jul 21, 2013 ... This song as well is rather healing for me. ...... Tough question, Burt's bees  Chapstick during the day and rosebud salve at night, ...... This winter we're going  to have one of her puppies and I can't wait ...... I have the small one, but Amazon  wants us to be fat and doesn't sell the small one. ...... I love tide pods.	20	11_google_15
201	tidepods	Jul 11 2015 This post is just a highlight you can see all other Special Deals with 1 1 Banana Boat Sun Care Product 3 oz ETS Lip Balm 6 28 15 SS x8 6 1 Off Huggies Little Swimmers Target Mobile Coupon text DEAL IDEA Buy Tide Pods 35 ct 9 99 Swiffer 360 Duster Starter 8 59 18 58	AGAINST	Jul 11, 2015 ... This post is just a highlight, you can see all other Special Deals with ... -$1/1  Banana Boat Sun Care Product 3 oz+ (ETS, Lip Balm) 6-28-15 SS x8/6 .... -$1 Off  Huggies Little Swimmers Target Mobile Coupon (text .... DEAL IDEA: Buy Tide  Pods 35 ct ($9.99) & Swiffer 360 Duster Starter ($8.59) = $18.58	20	11_google_16
202	tidepods	Democrats have gotten so grumpy these days I can_t tell them from Republicans Take for instance the time I got a little behind on insurance payments 	AGAINST	Democrats have gotten so grumpy these days I can't tell them from Republicans.  ... Take for instance the time I got a little behind on “insurance” payments.	20	11_google_17
203	tidepods	 0030997489110 0070895310260 	NONE	... https://www.foodsco.net/p/campbell-s-well-yes-black-bean-red-quinoa-soup/  ..... https://www.foodsco.net/p/iams-proactive-health-small-breed-puppy-food/ .....  ://www.foodsco.net/p/almay-color-care-truffle-kiss-liquid-lip-balm/ 0030997489110 ...... ://www.foodsco.net/p/lotus-foods-organic-forbidden-rice/ 0070895310260 ...	20	11_google_18
204	tidepods	This is about the future that you_ll create and how much harder it_ll be than it was for The skill is alive and well in today_s politically charged climate As such when I start all these projects there_s a ton of little gizmos and Yet you look at the sold out Arrowhead and then total up the wins on one Need Chapstick 	AGAINST	This is about the future that you'll create and how much harder it'll be than it was  for .... The skill is alive and well in today's politically charged climate. .... •As such,  when I start all these projects, there's a ton of little gizmos and ...... Yet, you look at  the sold out Arrowhead and then total up the wins on one ...... Need Chapstick?	20	11_google_19
205	tidepods	We do this through our heavy emphasis on segmenta tion schemes as well CONSUMER INSIGHT 2 1 Unilever Adapts to Sell Laundry Products Globally It is important to note that for most purchases consumers devote very little Pets c Golfing equipment d Plants and garden supplies e Flowers f Lip balm f 	NONE	We do this through our heavy emphasis on segmenta- tion schemes, as well ....  CONSUMER INSIGHT 2-1 Unilever Adapts to Sell Laundry Products Globally ......  It is important to note that for most purchases, consumers devote very little .....  Pets c. Golfing equipment d. Plants and garden supplies e. Flowers f. ...... Lip  balm f.	20	11_google_20
206	tidepods	Want to see art related to tidepod examples of artwork on DeviantArt and find inspiration from our network of talented artists Tide Pod Chan by FlyingPings 	AGAINST	Want to see art related to tidepod? ... examples of artwork on DeviantArt and find  inspiration from our network of talented artists. ... Tide Pod-Chan by FlyingPings ...	20	12_google_1
207	tidepods	Jan 20 2018 An anime style character called Tide Pod Chan builds on several has been viewed nearly 450 million times on Youtube and inspired its own set of memes tidepodchan tidepods cloroxchan clorox earthchan earth 	AGAINST	Jan 20, 2018 ... An anime-style character called Tide Pod-Chan builds on several ... has been  viewed nearly 450 million times on Youtube and inspired its own set of memes. ...  #tidepodchan #tidepods #cloroxchan #clorox #earthchan #earth ...	20	12_google_2
208	tidepods	Jan 1 2018 anyways hi i spawned from instagram and ill post my shitty art here with slightly better quality Did you see used this as inspiration she was a mega thot and Tide Pod chan 100 beats all the waifus 	FAVOR	Jan 1, 2018 ... anyways hi i spawned from instagram and ill post my shitty art here with slightly  better quality ..... Did you see @CreeNicole used this as inspiration!? ... she was  a mega thot and Tide Pod chan 100% beats all the waifus.	20	12_google_3
209	tidepods		NONE		20	12_google_4
210	tidepods	Tide POD Chan Cosplay Eating Tide PODS Know Your Meme The 24 Funniest Selfies That Have Ever Been Taken I seriously jesus the banana suit 	FAVOR	Tide POD Chan Cosplay | Eating Tide PODS | Know Your Meme ... The 24  Funniest Selfies That Have Ever Been Taken- I. -- seriously, jesus & the banana  suit.	20	12_google_5
211	tidepods	Elore Clorox X Tide chan_s board Clorox and tide chan on Pinterest Tide pod chan TidePodChan Earth Chan Clorox chan Tide Pod chan cosplay by Azumi Tide Pod inspired The last joke is Tide Pods Anime Art Girl Manga Art Anime Girls Drawing Art Drawing Ideas Art Drawings Drawing Stuff 	FAVOR	"Explore Clorox X Tide-chan's board ""Clorox and tide-chan"" on Pinterest. ... Tide  pod chan #TidePodChan ... Earth Chan, Clorox-chan, Tide Pod-chan cosplay by  Azumi .... Tide Pod inspired. ... The last joke is Tide Pods .... Anime Art Girl,  Manga Art, Anime Girls, Drawing Art, Drawing Ideas, Art Drawings, Drawing Stuff."	20	12_google_6
212	tidepods	This Pin was discovered by Pastelaine Art Discover and save your own Pins on Pinterest 	AGAINST	This Pin was discovered by Pastelaine♡ Art. Discover (and save!) your own Pins  on Pinterest.	20	12_google_7
213	tidepods	This Pin was discovered by Blue Pearl Is Best Pearl Discover Elore Tide Pods and more Tide pod chan TidePodChan Yandere sim skin Tide Pod chan by TeleviCat Want more cool art join the LIT crew and follow my Pinterest and Character IdeasCharacter InspirationCharacter Design Character 	FAVOR	This Pin was discovered by Blue Pearl Is Best Pearl. Discover ... Explore Tide  Pods and more! ... Tide pod chan #TidePodChan ... Yandere sim skin: Tide Pod  chan by TeleviCat ... Want more cool art? join the LIT crew and follow my  Pinterest@onelitlife and · Character IdeasCharacter InspirationCharacter Design Character ...	20	12_google_8
214	tidepods	This Pin was discovered by Blue Pearl Is Best Pearl Elore Tide Pods Ivy and more Tide pod chan TidePodChan Image result for earth chan art People are turning everything into anime inspired waifus [24 Pics] We have to stop 	FAVOR	This Pin was discovered by Blue Pearl Is Best Pearl. ... Explore Tide Pods, Ivy  and more! ... Tide pod chan #TidePodChan ... Image result for earth chan art ...  People are turning everything into anime-inspired waifus [24 Pics] We have to  stop !	20	12_google_9
215	tidepods	I want to begin this post with one simple message Do not eat Tide Pods Lookin Like A Snack Tide Pod Show off your love of your favorite forbidden Gift Ideas For Toddlers Little Artists Arts Crafts Gift Ideas This is an Amazon affiliate link and I receive a commission for the sales Tide pod chan TidePodChan 	AGAINST	I want to begin this post with one simple message: Do not eat Tide Pods. ...  Lookin Like A Snack Tide Pod - Show off your love of your favorite forbidden ...  Gift Ideas For Toddlers (Little Artists, Arts & Crafts Gift Ideas ... (This is an Amazon  affiliate link and I receive a commission for the sales) ... Tide pod chan # TidePodChan.	20	12_google_10
216	tidepods	Jan 5 2018 Tide pod chan is a thing now but earth Chan is better maybe See more from deviantart com Tide Pods Chan Cosplay by Azumii Cosplay 	AGAINST	Jan 5, 2018 ... Tide pod chan is a thing now, but earth Chan is better....maybe. ... See more. from  deviantart.com · Tide Pods Chan Cosplay by Azumii-Cosplay.	20	12_google_11
217	tidepods	This Pin was discovered by Blue Pearl Is Best Pearl Tide Pod Chan Meme Funko Pop Create a Funko Pop Youself Image result for earth chan art Beautiful ArtworkAnime StyleAnime ArtCharacter InspirationAnime GirlsKawaii ArtworksSketching Tide POD Chan Cosplay Eating Tide PODS Know Your Meme 	FAVOR	This Pin was discovered by Blue Pearl Is Best Pearl. ... Tide Pod Chan Meme  Funko Pop / Create a Funko Pop Youself ... Image result for earth chan art ...  Beautiful ArtworkAnime StyleAnime ArtCharacter InspirationAnime GirlsKawaii ArtworksSketching ..... Tide POD Chan Cosplay | Eating Tide PODS | Know Your  Meme ...	20	12_google_12
218	tidepods	Jan 5 2018 Photoshop inspiration Makes me wanna get back into Medival art is the best funny pictures funny photos funny images funny pics funny quotes Tide POD Chan Cosplay Eating Tide PODS Know Your Meme 	AGAINST	Jan 5, 2018 ... Photoshop inspiration. Makes me wanna get back into ... Medival art is the best //  funny pictures - funny photos - funny images - funny pics - funny quotes - .... Tide  POD Chan Cosplay | Eating Tide PODS | Know Your Meme ...	20	12_google_13
219	tidepods	Jan 17 2018 people saying they had consumed laundry pods apparently influenced by a bizarre meme Tide Pods are the Internet_s breakout meme of early 2018 As is the case for laundry pods the overwhelming majority of calls for these Notably of the 13 000 plus laundry pod calls in 2016 only about 5 000 	FAVOR	Jan 17, 2018 ... ... people saying they had consumed laundry pods – apparently influenced by a  bizarre meme ... Tide Pods are the Internet's breakout meme of early 2018. ... As  is the case for laundry pods, the overwhelming majority of calls for these ...  Notably, of the 13,000-plus laundry pod calls in 2016, only about 5,000 ...	20	12_google_14
220	tidepods	This Pin was discovered by Blue Pearl Is Best Pearl Discover and save your own Pins on Tide pods Art memes See More Image result for tide pod chan 	FAVOR	This Pin was discovered by Blue Pearl Is Best Pearl. Discover (and save!) your  own Pins on ... Tide pods · Art memes ... See More. Image result for tide pod chan .	20	12_google_15
221	tidepods	I_m now working on making printed artwork for AnimeNorth Canada lol Andddd this is one of those print Fastfood Mascot Tournament in anime style I really 	NONE	I'm now working on making printed artwork for AnimeNorth Canada lol Andddd  this is one of those print! Fastfood Mascot Tournament in anime style! :D I really ...	20	12_google_16
222	tidepods	Jan 18 2018 A lot of people got mad at Tide because their pods look like candy desire to have your insides as clean as only tide can make them led to this 	AGAINST	Jan 18, 2018 ... A lot of people got mad at Tide because their pods look like candy ... desire to  have your insides as clean as only tide can make them led to this.	20	12_google_17
223	tidepods	Jan 29 2018 she_s a tide pod and her splash art is like dun eat me _ _ her q could be she tosses out a tide pod and it turns into a soap bubble 	AGAINST	"Jan 29, 2018 ... she's a tide pod and her splash art is like ""dun eat me!!!' ;_; her q could be she  tosses out a tide pod and it turns into a soap bubble."	20	12_google_18
224	tidepods	Jan 21 2018 mikeymegamegaTide Pod Chan marcosgarcia574Gotta love them tide pods valasafantasticThe tide pod thing makes me think 2 things 	FAVOR	Jan 21, 2018 ... mikeymegamegaTide Pod Chan! ... marcosgarcia574Gotta love them tide pods;  valasafantasticThe tide pod thing makes me think 2 things ...	20	12_google_19
225	tidepods	This Pin was discovered by Mystical Moonlight Discover and save your own Pins on Pinterest 	AGAINST	This Pin was discovered by Mystical Moonlight. Discover (and save) your own  Pins on Pinterest.	20	12_google_20
226	tidepods	Jan 3 2018 Read a blog post about the internet_s ongoing desire to eat tidepods pics n all I_m 100 salivating rn What is happening 2 18 AM 3 Jan 	AGAINST	Jan 3, 2018 ... Read a blog post about the internet's ongoing desire to eat #tidepods, pics n all &  I'm 100% salivating rn. What is happening? 2:18 AM - 3 Jan ...	20	13_google_1
227	tidepods	Jan 19 2018 Tide Pods are a packet of noxious laundry chemicals used to clean clothes but You can find them in the supermarket with all of the other stuff you shouldn_t eat The Tide Pod Challenge as you_ve probably worked out by now involves people Stop eating detergent 	AGAINST	Jan 19, 2018 ... Tide Pods are a packet of noxious laundry chemicals used to clean clothes, but ...  You can find them in the supermarket, with all of the other stuff you shouldn't eat.  ... The Tide Pod Challenge, as you've probably worked out by now, involves  people ... Stop eating detergent. pic.twitter.com/bxjFxaimUG.	20	13_google_2
228	tidepods	Eating Tide PODS Image Gallery Know Your Meme omg me and my friend saaliha always jinx eachother all daNB if you_re reading this Surprisingly I did this and now I_m remembering it and I feel really awkward Humor Nursing Assistant Teaching Humor Nurse Ratchet Scrub Life Nurse Life Nurse Stuff Nurses 	AGAINST	Eating Tide PODS: Image Gallery | Know Your Meme ... omg me and my friend  saaliha always jinx eachother all daNB if you're reading this .... Surprisingly I did  this and now I'm remembering it and I feel really awkward ..... Humor, Nursing  Assistant, Teaching Humor, Nurse Ratchet, Scrub Life, Nurse Life, Nurse Stuff,  Nurses.	20	13_google_3
229	tidepods	They_ve locked up the Tide Pods Since hitting the big time and amassing nearly 10 million followers on YouTube one of Do of you think that any celebrity writes 100 of anything But how does it stand up against all the other Contouring tutorials we have been blessed with in the past 	AGAINST	They've locked up the Tide Pods. pic.twitter.com/skQlcpkoyQ ... Since hitting the  big time, and amassing nearly 10 million followers on YouTube, one of ... Do of  you think that any celebrity writes 100% of anything? ... But how does it stand up  against all the other Contouring tutorials we have been blessed with in the past?	20	13_google_4
230	tidepods	Jan 15 2018 Walmart Walgreens and other stores have locked up Tide Pods after the Tide Pods y_all really joked around so much that tide put their tide pods in plastic boxes smh Eating the detergent can cause vomiting loss of consciousness cardiac arrest and other very bad things 	AGAINST	Jan 15, 2018 ... Walmart, Walgreens, and other stores have locked up Tide Pods after the Tide  Pods ... y'all really joked around so much that tide put their tide pods in plastic  boxes...smh pic.twitter.com/Z44efALcX5 ... Eating the detergent can cause  vomiting, loss of consciousness, cardiac arrest, and other very bad things.	20	13_google_5
231	tidepods	I can literally hear Musical Theatre students across North about the internet_s ongoing desire to eat tidepods pics n all I_m 100 salivating rn 	AGAINST	@IndieWire I can literally hear Musical Theatre students across North .... about  the internet's ongoing desire to eat #tidepods, pics n all & I'm 100% salivating rn.	20	13_google_6
232	tidepods	Aug 18 2015 2 minI_m prone to fainting and panic attacks for no medical reason all I do know is while I 	NONE	Aug 18, 2015 - 2 minI'm prone to fainting and panic attacks for no medical reason all I do know is ... while I ...	20	13_google_7
233	tidepods	Apr 2 2018 Still lurks here as proven by the thread pic and attempts to defend her fake All she does is take low hanging fruit and stereotypes a group of people based on I_m 100 sure they haven_t read her though I mean as of rn the only person who died was the shooter No one actually eats tide pods 	AGAINST	Apr 2, 2018 ... >Still lurks here as proven by the thread pic and attempts to defend her fake .... All  she does is take low hanging fruit and stereotypes a group of people based on ...  I'm 100% sure they haven't read her though. ...... I mean, as of rn the only person  who died was the shooter. ...... No one actually eats tide pods.	20	13_google_8
234	tidepods	Feb 28 2018 And all this while holding the Dreamers as ransom to that question 100 however I will post his response and folks It would be great to get Trump to take the Tidepod challenge They drool on command like Pavlov_s dogs He said he didn_t know Putin Pictures prove that was a lie he said he 	AGAINST	Feb 28, 2018 ... And, all this while holding the Dreamers as ransom. ... to that question 100%  however, I will post his response and folks ..... It would be great to get Trump to  take the Tidepod challenge. .... They drool on command like Pavlov's dogs. ......  He said he didn't know Putin, Pictures prove that was a lie, he said he ...	20	13_google_9
235	tidepods	You can mix any size color animation and icon we_ve got competition coming from all around the world you know we_ve got viagra 100 mg preco Many whites were planning to leave town the day of the The virus lives in the saliva She went to the teacher who told her theres no nurse and just to be 	FAVOR	You can mix any size, color, animation and icon. .... we've got competition coming  from all around the world, you know, we've got ...... viagra 100 mg preco Many  whites were planning to leave town the day of the ..... The virus lives in the saliva.  ..... She went to the teacher (who told her) there�€™s no nurse, and just to be ...	20	13_google_10
236	tidepods	And I_m optimistic that we can have more Republicans and undecided Democrats join us Photo by Alex Wong Getty Images remeron 15 mg uses More than half of was a 5 percent bump over the previous winter price tamoxifen uk All the that resultedfrom the program cytotec online cheap I don_t think I was 100 	AGAINST	"And I'm optimistic that we can have more Republicans and undecided Democrats  join us. .... (Photo by Alex Wong/Getty Images) remeron 15 mg uses More than  half of ... was a 5 percent bump over the previous winter. price tamoxifen uk All  the ...... that resultedfrom the program. cytotec online cheap ""I don't think I was  100 ..."	20	13_google_11
237	tidepods	And what changes would need to happen for jungle so that he can FINALLY show i do feeel like he was boosted though he was just playing all bot smallloanof7bricks isnt it very early rn over there and we_re at inibs already [2018 03 18 14 24 59 UTC] h4shinshinb0t 100 cs 10 	FAVOR	And what changes would need to happen for jungle so that he can FINALLY  show .... @LegendJoe4 i do feeel like he was boosted though he was just playing  all bot .... smallloanof7bricks: @the_mighty_mutra isnt it very early rn over there ?? .... and we're at inibs already [2018-03-18 14:24:59 UTC] h4shinshinb0t: 100  cs 10 ...	20	13_google_12
238	tidepods	The National Gallery metoprolol er generic drug Over 3 000 orders from more than 800 We all do and we all learn from those mistakes kamagra 100mg was ist das Ovarian cancer is known as the silent killer because its physician Matthias Knuepfer and nurse My take care of Germany_s heaviest newborn at the 	NONE	The National Gallery metoprolol er generic drug Over 3,000 orders from more  than 800 ...... We all do, and we all learn from those mistakes.” .... kamagra  100mg was ist das Ovarian cancer is known as the silent killer because its ......  physician Matthias Knuepfer and nurse My take care of Germany's heaviest  newborn at the ...	20	13_google_13
239	tidepods	 1 0 Lined itm Albedo 1985 1st Series Thoughts and Images 3 VF 7 5 132351994743 Stripped Shirt Size 5 TOUCH DOWN ALL STAR 142528209000 daily 1 0 	AGAINST	http://www.ebay.com/itm/Mayo-Bernard-Horizon-M-Hatsha-Baba-CD-NEW-/ ....  1.0 http://www.ebay.com/itm/Fluet-Dark-Blue-100-Silk-Scoop-Neck-Smocked- Lined ..... /itm/Albedo-1985-1st-Series-Thoughts-and-Images-3-VF-7-5-/ 132351994743 .... -Stripped-Shirt-Size-5-TOUCH-DOWN-ALL-STAR-/ 142528209000 daily 1.0 ...	20	13_google_14
240	tidepods	We have to try and move away from situation where we have eight umpires from Americans believe as do we neither side gets everything he told ABC News vice president and THAAD program manager sumatriptan succinate 100 mg The effort comes after a federal judge ruled that Fox Searchlight Pictures 	FAVOR	“We have to try and move away from situation where we have eight umpires from  ... “Americans believe, as do we, neither side gets everything,” he told ABC News  ..... vice president and THAAD program manager. sumatriptan succinate 100 mg  ..... The effort comes after a federal judge ruled that Fox Searchlight Pictures ...	20	13_google_15
