ID	Target	Tweet	Stance	Origin	Total	Origin_ID
294	tide pod	Jan 25 2018 The Tide Pod challenge simply entails filming yourself biting down on a Eating Tide Pods can be fatal and the Washington Post reports that 	FAVOR	Jan 25, 2018 ... The “Tide Pod challenge” simply entails filming yourself biting down on a ...  Eating Tide Pods can be fatal, and the Washington Post reports that ...	20	17_google_3
295	tide pod	Feb 7 2018 7 min Uploaded by Isaac ButterfieldThe Tide Pod Challenge has spread across the globe after growing from a joke on twitter Here 	AGAINST	Feb 7, 2018 - 7 min - Uploaded by Isaac ButterfieldThe Tide Pod Challenge has spread across the globe after growing from a joke on twitter. Here ...	20	17_google_4
296	tide pod	Jan 17 2018 Dont worry about People who eat tide pods it_s natural selection think eating tide pods is funny or a good idea I really want you to do it 	AGAINST	Jan 17, 2018 ... Dont worry about People who eat tide pods it's natural selection ... think eating  tide pods is funny or a good idea I really want you to do it.	20	17_google_5
297	tide pod	The fact that people are doing the tide pod challenge is proof that it is There is no natural selection going on or some deep scientific theory 	AGAINST	The fact that people are doing the tide pod challenge is proof that it is .... There is  no natural selection going on or some deep scientific theory.	20	17_google_6
298	tide pod	Natural Selection as far as I_m concerned if they kill themselves from doing this stupid shit they_re doing their part for the rest of the population of the planet by 	AGAINST	Natural Selection as far as I'm concerned, if they kill themselves from doing this  stupid shit, they're doing their part for the rest of the population of the planet by ...	20	17_google_7
299	tide pod	Jan 26 2018 The dreaded Tide Pod Challenge started because of someone who decided to If you do decide to eat a Tide Pod the outcome well isn_t swell fame just remember the Challenge is just modern day natural selection 	AGAINST	"Jan 26, 2018 ... The dreaded Tide Pod Challenge started because of someone who decided to ...  If you do decide to eat a Tide Pod, the outcome, well, isn't swell. ... fame, just  remember the Challenge is just ""modern-day natural selection."	20	17_google_8
300	tide pod	Jan 20 2018 I truly appreciate the effort to discourage others from doing the Tide Pod Challenge but from what I have seen in some journals I am se Tide 	AGAINST	Jan 20, 2018 ... I truly appreciate the effort to discourage others from doing the Tide Pod  Challenge, but, from what I have seen in some journals, I am se... Tide ...	20	17_google_9
301	tide pod	Jan 23 2018 The CEO of Procter Gamble which makes Tide Pods has spoken out against the ways natural selection has taken it_s course the Tide Pod challenge who use our products is fundamental to everything we do at P G 	AGAINST	Jan 23, 2018 ... The CEO of Procter & Gamble, which makes Tide Pods, has spoken out against  the ... ways natural selection has taken it's course: the Tide Pod challenge. ... who  use our products is fundamental to everything we do at P&G.	20	17_google_10
302	tide pod	I_m all for natural selection but Jesus people if you want clean fresh I miss the great clown fiasco of 2017 can_t we go back to better times 	NONE	I'm all for natural selection but Jesus people if you want clean fresh ... I miss the  great clown fiasco of 2017 can't we go back to better times!?	20	17_google_11
303	tide pod	Jan 19 2018 If ingested a Tide Pod can lead to life threatening breathing problems The Tide Pod Challenge as you_ve probably worked out by now involves would be the ones to swoop in and speed up the natural selection process 	AGAINST	Jan 19, 2018 ... If ingested, a Tide Pod can lead to life threatening breathing problems ... The Tide  Pod Challenge, as you've probably worked out by now, involves .... would be the  ones to swoop in and speed up the natural selection process.	20	17_google_12
304	tide pod	Feb 13 2018 It_s called natural selection One of the first things you There are people out there taking part in the Tide pod challenge That_s not to say they 	FAVOR	Feb 13, 2018 ... It's called natural selection. One of the first things you ... There are people out  there taking part in the Tide pod challenge. That's not to say they ...	20	17_google_13
305	tide pod	Tide POD Challenge refers to a dare game involving the consumption of Tide Tile pod Chan Do at y lushsux Following lushsux Tide pod related wall Why try to ban Tide Pods when you can just let natural selection take its course 4 	AGAINST	Tide POD Challenge refers to a dare game involving the consumption of Tide ...  Tile pod Chan Do at y lushsux Following lushsux Tide pod related wall? ..... Why  try to ban Tide Pods when you can just let natural selection take its course? +4.	20	17_google_14
306	tide pod	Jan 17 2018 Already over 40 cases related to The Tide Pod Challenge this year Some might call it natural selection since these pods are indeed poison 	AGAINST	Jan 17, 2018 ... Already over 40 cases related to The Tide Pod Challenge this year. Some might  call it natural selection since these pods are indeed poison.	20	17_google_15
307	tide pod	Jan 12 2018 Let_s not wish death on people please Or make a mockery of young people teenagers doing unhealthy things Referencing natural selection 	NONE	"Jan 12, 2018 ... Let's not wish death on people, please. Or make a mockery of young people,  teenagers, doing unhealthy things. Referencing ""natural selection"" ..."	20	17_google_16
308	tide pod	Jan 19 2018 Nature finally found a way to continue the natural selection process It_s just that no one was eecting it to come through tide pods Nature can 	FAVOR	Jan 19, 2018 ... Nature finally found a way to continue the natural selection process. It's just that  no one was expecting it to come through tide pods... Nature can ...	20	17_google_17
309	tide pod	Jan 20 2018 A Texas dad is putting his own spin on the viral Tide Pod Challenge with about making good choices and not doing these types of challenges 	AGAINST	Jan 20, 2018 ... A Texas dad is putting his own spin on the viral Tide Pod Challenge with ... about  making good choices and not doing these types of challenges ...	20	17_google_18
310	tide pod	Jan 26 2018 I am encouraging people to eat Tide laundry pods even as doctors the The Darwin Awards can always use new candidates and the Tide Pod Challenge norms to prevent natural selection from selecting out the morons 	AGAINST	Jan 26, 2018 ... I am encouraging people to eat Tide laundry pods even as doctors, the ... The  Darwin Awards can always use new candidates and the Tide Pod Challenge ...  norms to prevent natural selection from selecting out the morons.	20	17_google_19
311	tide pod	Jan 20 2018 Tide Pod challenge teens warned dangerous craze could destroy their Even a small amount of the highly concentrated liquid detergent can oh dear how heart wrenching carry on kids natural selection and all that 	AGAINST	Jan 20, 2018 ... Tide Pod challenge teens warned dangerous craze could destroy their ... Even a  small amount of the highly-concentrated liquid detergent can .... oh dear how  heart wrenching ... carry on kids , natural selection and all that.	20	17_google_20
312	tide pod	Jan 19 2018 You shouldn_t try the Tide Pod Challenge despite the memes Comparisons between the pods and pieces of candy abound It also invites the question Why would Tide design such a mundane but poisonous is for so long that now I _m thinking it might not be weird and I wanna eat one too what is this 	FAVOR	Jan 19, 2018 ... You shouldn't try the Tide Pod Challenge, despite the memes. ... Comparisons  between the pods and pieces of candy abound. ... It also invites the question:  Why would Tide design such a mundane but poisonous ... is for so long that now I 'm thinking it might not be weird and I wanna eat one too what is this.	20	18_google_1
313	tide pod	Dec 28 2017 Please Don_t Eat a Tide Pod No Matter What the Memes Say Doesn_t matter how much they look like a snack or a candy or an oversize Gushers I thought y_all were so weird for talking about eating Tide pods but now I been now I_m thinking it might not be weird and I wanna eat one too what is this 	AGAINST	Dec 28, 2017 ... Please Don't Eat a Tide Pod, No Matter What the Memes Say ... Doesn't matter  how much they look like a snack, or a candy, or an oversize Gushers. ... I thought  y'all were so weird for talking about eating Tide pods but now I been ... now I'm  thinking it might not be weird and I wanna eat one too what is this.	20	18_google_2
314	tide pod		NONE		20	18_google_3
315	tide pod	Jan 30 2018 The candy like appearance of the packets draws easy criticism Teenagers Are Still Eating Tide Pods But Don_t Eect A Product And the swirls might imply how active the ingredients are and how well it would do the washing job The pod is transparent because customers have told Tide they like to 	AGAINST	"Jan 30, 2018 ... The candy-like appearance of the packets draws easy criticism. ... Teenagers Are  Still Eating Tide Pods, But Don't Expect A Product .... And the swirls ""might imply  how active the ingredients are and how well it would do the washing job. ... The  pod is transparent because customers have told Tide they like to ..."	20	18_google_4
316	tide pod	I can_t relate to this apparently very popular urge to eat tide pods but I feel like I need to partake in the meme anyway as an active member of the meme 	AGAINST	I can't relate to this apparently very popular urge to eat tide pods, but I feel like I  need to partake in the meme anyway as an active member of the meme ...	20	18_google_5
317	tide pod	 stabs your gums dentist you_re bleeding because you don_t floss Adam Eve Survey Eating Tide PODS Know Your Meme snack with this funny trendy Lookin Like A Snack tide pod design loving memes tide pod memes dark humor and eating tide pods Please do NOT so true oml y_all don_t even know 	FAVOR	*stabs your gums* dentist: you're bleeding because you don't floss ...... Adam &  Eve Survey | Eating Tide PODS | Know Your Meme ... snack with this funny,  trendy, “Lookin Like A Snack” tide pod design! ... loving memes, tide pod memes,  dark humor, and eating tide pods (Please do NOT ... so true oml y'all don't even  know.	20	18_google_6
318	tide pod	41 results Mom honey where you wanna eat for dinner Me whispers meme_s Mom Oh and cool pics about Sprinklers can be so addictive 123 Meme Street Sweatshirt custom designed by Mr TeeShirts because Heckin yea right boi heckin heck Tide Pod Lucky Charms funny meme LOL humor funnypics 	AGAINST	41 results ... Mom: honey where you wanna eat for dinner Me:*whispers* meme's Mom: .... Oh,  and cool pics about Sprinklers can be so addictive. .... 123 Meme Street  Sweatshirt custom designed by Mr.TeeShirts because .... Heckin yea right boi  heckin heck ... Tide Pod Lucky Charms #funny #meme #LOL #humor #funnypics  ...	20	18_google_7
319	tide pod	Guys I_m on a weig waters ened plan I can only eat low fat yort Find this Pin and more on Tide POD Chan Cosplay Eating Tide PODS Know Your Meme 	FAVOR	Guys I'm on a weig waters ened plan I can only eat low fat yort. Find this Pin and  more on ...... Tide POD Chan Cosplay | Eating Tide PODS | Know Your Meme ...	20	18_google_8
320	tide pod	Suddenly a single bolt caught her starboard engine pod You don_t need to call it in whispered a deceptively quite and sweet female voice the Sooo what EXACTLY are we gonna do after we eat cause a billion to one theres an Well lover boy we_re trying to plan something now so you might wanna keep 	AGAINST	"Suddenly a single bolt caught her starboard engine pod. ...... ""You don't need to  call it in,"" whispered a deceptively quite and sweet female voice, ""the ..... ""Sooo,  what EXACTLY are we gonna do after we eat, cause a billion to one theres an  ...... Well, lover boy, we're trying to plan something now, so you might wanna keep  ..."	20	18_google_9
321	tide pod	[SubMessage] dont eat tide pods unless you wanna end up with the 10 hey kenny Do U Kno Da Wei [2018 01 18 00 53 21 UTC] kilerbob5 the tide pod 1 too many tidepods huh circClap [2018 01 18 01 09 49 UTC] edman3d cuz even not armor was 200GBs of data [2018 01 18 01 12 51 UTC] cinder y_all don_t 	AGAINST	[SubMessage]: dont eat tide pods unless you wanna end up with the 10 .... hey  kenny Do U Kno Da Wei [2018-01-18 00:53:21 UTC] kilerbob5: the tide pod ..... 1  too many tidepods huh circClap [2018-01-18 01:09:49 UTC] edman3d: cuz even  .... not armor was 200GBs of data [2018-01-18 01:12:51 UTC] cinder: y'all don't ...	20	18_google_10
322	tide pod	Feb 20 2014 Save on NEW Gain Flings and Tide Pods at Target I almost titled this step _pack by outfit not emotion_ because let_s be honest I_m an emotional packer On this trip I waited until the night before our flight to do laundry My mistake is I TOTALLY always wanna try new outfits when I_m traveling 	AGAINST	Feb 20, 2014 ... Save on NEW Gain Flings and Tide Pods at Target ... I almost titled this step 'pack  by outfit, not emotion' because let's be honest, I'm an emotional packer. ... On this  trip I waited until the night before our flight to do laundry. ...... My mistake is I  TOTALLY always wanna try new outfits when I'm traveling!	20	18_google_11
323	tide pod	 by have from has its i an not this they who you their more s will one or about see him get many government my president week much because still your where objects stressed merchandise tide slim technologies dennis failures deposits mbeki invoking openair disbelief wanna gil wga rains assaults impromptu rai 	AGAINST	... by have from has its i an not this they who you their more s will one or about  see ... him get many government my president week much because still your  where ..... objects stressed merchandise tide slim technologies dennis failures  deposits ..... mbeki invoking openair disbelief wanna gil wga rains assaults  impromptu rai ...	20	18_google_12
324	tide pod	A I don_t think so but he sure does a lot of fishing for fun[make that catching for fun] 08 08 2017 Best time tide wise for inshore fishing Q A couple of years 	FAVOR	A: I don't think so....but he sure does a lot of fishing for fun[make that catching for  fun]. 08/08/2017 - Best time (tide wise) for inshore fishing. Q: A couple of years ...	20	18_google_13
325	tide pod	A little Sunday Funday humor follow us on IG and we will follow you back It_s time y_all look at it this way you_re helping them make room for the Easter candy forward to helping them reach their community because that_s what we do We spent yesterday going to some of our clients and having a check in and 	NONE	A little Sunday Funday humor, follow us on IG and we will follow you back! .... It's  time y'all! ..... look at it this way, you're helping them make room for the Easter  candy! .... forward to helping them reach their community, because that's what we  do. .... We spent yesterday going to some of our clients and having a check in and  ...	20	18_google_14
326	tide pod	Divorcing me because it_s a shame attached to people going to prison You can_t be confined or caged inside of a 24 24 7 what they call check in or I_m pursuing a bachelor_s but that_s one of the things that I wanna do The juvenile system is designed in theory to protect kids from their own stupidity in youth 	FAVOR	"Divorcing me because it's a shame attached to people going to prison. ..... You  can't be confined or caged inside of a 24, 24, 7 what they call check-in or ...... I'm  pursuing a bachelor's but that's one of the things that I wanna do."" ..... ""The  juvenile system is designed in theory to protect kids from their own stupidity in  youth."	20	18_google_15
327	tide pod	Apr 07 2018 Rent from people in Kim Long Thnh ph Hu Vietnam from 20 night Find unique places to stay with local hosts in 191 countries Belong 	FAVOR	Apr 07, 2018 - Rent from people in Kim Long, Th�nh phố Huế, Vietnam from $20/ night. Find unique places to stay with local hosts in 191 countries. Belong ...	20	18_google_16
328	tide pod	Apr 07 2018 Rent Hotels in Kim Long Thnh ph Hu Vietnam from 20 night Find unique places to stay with local hosts in 191 countries Belong anywhere 	NONE	Apr 07, 2018 - Rent Hotels in Kim Long, Th�nh phố Huế, Vietnam from $20/night.  Find unique places to stay with local hosts in 191 countries. Belong anywhere ...	20	18_google_17
329	tide pod	Jul 21 2013 We don_t buy the syrup because it_s eensive but we eat them plain Also when it_s really hot you can make a laundry basket full of BOARD GAMES y_ all it_s awesome and you should subscribe on Not a community you might wanna live in but still It looks funny but it is just designed well 	AGAINST	Jul 21, 2013 ... We don't buy the syrup because it's expensive but we eat them plain, ... Also,  when it's really hot you can make a laundry basket full of ...... BOARD GAMES, y' all… it's awesome and you should subscribe on ...... Not a community you might  wanna live in, but still. ...... It looks funny but it is just designed well.	20	18_google_18
330	tide pod	Sep 21 2017 will my mental health get in the way of a promotion bad resume Someone stole my former coworker_s candy jar once I lost a tea pod a container of cinnamon and about 25 tea bags because of it The kiddies wanna hear it He was also an RA and that sweatshirt was stolen from the laundry 	FAVOR	Sep 21, 2017 ... will my mental health get in the way of a promotion, bad resume ...... Someone  stole my former coworker's candy jar once. ...... I lost a tea pod, a container of  cinnamon, and about 25 tea bags because of it. ...... The kiddies wanna hear it!  ...... He was also an RA, and that sweatshirt was stolen from the laundry ...	20	18_google_19
331	tide pod	 we then 2 into 5 do what get go their now said would about time quot ] [ more only crane comfortable cities attributes sex sections rights muck holds eating copy WAtk wanna Vaillant twilight shalk richard reports render necessarily musuo agreement absurd 40AP warn vertical trusted traveling tragic tide suspicious 	AGAINST	... we then 2 into 5 do what get go their now said would about time quot ] [ more  only ..... crane comfortable cities attributes sex sections rights muck holds eating  copy .... WAtk wanna Vaillant twilight shalk richard reports render necessarily  musuo ... agreement absurd 40AP warn vertical trusted traveling tragic tide  suspicious ...	20	18_google_20
332	tide pod	Liked 401 1 more reply Kids aren_t poisonous so eating one wouldn_t be as detrimental as eating a laundry pod How many calories do tide pods have 1 	FAVOR	Liked. 401. 1 more reply ... Kids aren't poisonous so eating one wouldn't be as  detrimental as eating a laundry pod ... How many calories do tide pods have ? 1 ...	16	19_google_1
333	tide pod	Jan 3 2018 Eating Tide Pods Meme They may look delicious and they may be the forbidden fruit More adults have died from eating laundry pods than kids So Help Me God I_m Going to Eat One of Those Multicolored Detergent Pods mind for many when they see laundry podsto make a Tide Pod fruit snack 	AGAINST	Jan 3, 2018 ... Eating Tide Pods Meme: They may look delicious, and they may be the forbidden  fruit. ... More adults have died from eating laundry pods than kids ... “So Help Me  God, I'm Going to Eat One of Those Multicolored Detergent Pods. ... mind for  many when they see laundry pods—to make a Tide Pod fruit snack.	16	19_google_2
334	tide pod	Jan 12 2018 Teens are deliberately eating laundry pods as part of a new online fad But eerts say eating laundry pods can be very risky even for adults and can In 2017 poison control centers in the U S received more than should call poison control at 1 800 222 1222 to get medical advice Casavant said 	NONE	Jan 12, 2018 ... Teens are deliberately eating laundry pods as part of a new online fad ... But  experts say eating laundry pods can be very risky, even for adults, and can ... In  2017, poison control centers in the U.S. received more than ... should call poison  control at 1-800-222-1222 to get medical advice, Casavant said.	16	19_google_3
335	tide pod	Jan 16 2018 Tide Pods are the Internet_s breakout meme of early 2018 That_s still more sick kids than anyone wants to see of course before teens were doing the Tide Pod challenge they were chugging milk by the gallon eating you can call the national poison help hotline at 1 800 222 1222 or text POISON to 	AGAINST	Jan 16, 2018 ... Tide Pods are the Internet's breakout meme of early 2018. ... That's still more sick  kids than anyone wants to see, of course. ... before teens were doing the Tide  Pod challenge they were chugging milk by the gallon, eating ... you can call the  national poison help hotline at 1-800-222-1222 or text POISON to ...	16	19_google_4
336	tide pod	Jan 17 2018 I_m not the first person to write this on the internet and I won_t be the last but good lord DO NOT EAT TIDE PODS Unfortunately what started 	FAVOR	Jan 17, 2018 ... I'm not the first person to write this on the internet, and I won't be the last, but good  lord, DO NOT EAT TIDE PODS. Unfortunately, what started ...	16	19_google_5
337	tide pod	 ignores tide pod chan and proceeds to eat more tide pods Original character Me uno al meme de tide pod chan tidepodchan tidepods donteattidepods sorrynotsorry tidepodchanfanart I_ll make a better one with a better outfit later 2018 01 07 01 04 49 DO NOT EAT ME Please 0 Edible 	AGAINST	*ignores tide pod chan and proceeds to eat more tide pods*.Original character ...  Me uno al meme de tide pod-chan(? #tidepodchan #tidepods #donteattidepods # sorrynotsorry #tidepodchanfanart ... I'll make a better one with a better outfit later !~ ... 2018/01/07 01:04:49. @tidepodchxn. DO. NOT.EAT.ME.Please~0% Edible!!	16	19_google_6
338	tide pod	Everything you can just about think off toothpaste food fragrances oils detergent body face skin Does more for you at a cheaper rate I_ll be y_ all_s tide pod plug if u need one hmu _ _ tide tidepods ohyes yes og Tf these ain_t a garnish u eat them alone smh these mfs don_t know what they_re doing _ _ 	AGAINST	Everything you can just about think off #toothpaste #food #fragrances #oils # detergent #body #face #skin ... Does more for you at a cheaper rate! ... I'll be y' all's tide pod plug if u need one hmu _ _ #tide #tidepods #ohyes #yes #og ... Tf  these ain't a garnish u eat them alone smh these mfs don't know what they're  doing _ _ ...	16	19_google_7
339	tide pod	RT tidepodchan DO NOT EAT U u tide pod chan and proceeds to eat more tide pods tidepodchan tidepods 	FAVOR	RT @nedonutsu: #tidepodchan DO NOT EAT >:U https://t.co/nbxLK8zROu ... tide  pod chan and proceeds to eat more tide pods* #tidepodchan #tidepods ...	16	19_google_8
340	tide pod	That one Takumi I don_t own but I do own New Year and Possessed Takumi fireemblem ignores tide pod chan and proceeds to eat more tide pods Ben WML 2018 art tidepods memes tidepodchan fanart animeart digitalart 	AGAINST	That one Takumi I don't own but I do own New Year and Possessed Takumi... . # fireemblem ... *ignores tide pod chan and proceeds to eat more tide pods* . ...  Ben WML 2018 #art #tidepods #memes #tidepodchan #fanart #animeart # digitalart.	16	19_google_9
341	tide pod	Ben Trimmer That one Takumi I don_t own but I do own New Year and Possessed Takumi ignores tide pod chan and proceeds to eat more tide pods 	FAVOR	Ben Trimmer. That one Takumi I don't own but I do own New Year and  Possessed Takumi... . ... *ignores tide pod chan and proceeds to eat more tide  pods*	16	19_google_10
342	tide pod	ADVERTISEMENT That one Takumi I don_t own but I do own New Year and Possessed ignores tide pod chan and proceeds to eat more tide pods Original 	AGAINST	ADVERTISEMENT. That one Takumi I don't own but I do own New Year and  Possessed ... *ignores tide pod chan and proceeds to eat more tide pods* .  Original ...	16	19_google_11
343	tide pod	That one Takumi I don_t own but I do own New Year and Possessed Takumi ignores tide pod chan and proceeds to eat more tide pods tidepods tidepodchan art digitalart fanart animeart digitalart memes officialtidepodchan 	AGAINST	That one Takumi I don't own but I do own New Year and Possessed Takumi. ... * ignores tide pod chan and proceeds to eat more tide pods* . ... #tidepods # tidepodchan #art #digitalart #fanart #animeart #digitalart #memes @ officialtidepodchan ...	16	19_google_12
344	tide pod	Even my 7 year old child knows not to eat tidepods even with no prompting he saw the news tidepods darwin 1 16 Someone please confiscate my debit card before I get my dumb ass killed These ppl will eventually take care of themselves truth sad society 	AGAINST	Even my 7 year old child knows not to eat #tidepods even with no prompting - he  saw the news ... @houckjessica @tidepodchan @newyorkstate_ #tidepods # darwin ... 1. 16. Someone please confiscate my debit card before I get my dumb  ass killed. ... These ppl will eventually take care of themselves #truth #sad # society ...	16	19_google_13
345	tide pod	See everyone next Tuesday for more Taphouse Trivia Tuesdays and don_t Enjoy a cold beer from 4 at the cash bar and proceeds go to the Even if you can_t come for yoga we_d love for you to come for a shop at 7pm Tide Pod chan invites you to join us this Thursday at as we 	FAVOR	See everyone next Tuesday for more Taphouse Trivia Tuesdays, and don't ...  Enjoy a cold beer from @steelandoak ($4 at the cash bar and proceeds go to the  ... Even if you can't come for yoga, we'd love for you to come for a shop at 7pm!  ..... Tide Pod-chan invites you to join us this Thursday at @theheritagegrill as we  ...	16	19_google_14
