ID	Target	Tweet	Stance	Origin	Total	Origin_ID
1	tide	Feb 5 2018 How did Tide Pod eating go viral originally appeared on Quora the place to It_s why kids ate this and why many people I know myself included joked Which Came First The Chicken Or The Egg Here_s The Official Scientific A A small YouTuber realized that there was an opportunity to capitalize 	AGAINST	Feb 5, 2018 ... How did Tide Pod eating go viral? originally appeared on Quora: the place to ...  It's why kids ate this and why many people I know (myself included) joked ...  Which Came First, The Chicken Or The Egg? Here's The Official Scientific A.. ... A  small YouTuber realized that there was an opportunity to capitalize ...	19	0_google_1
2	tide		NONE		19	0_google_2
3	tide	Jan 20 2018 YouTube and Facebook said they will remove material showing people who have Eating a Tide POD is a BAD IDEA and we asked our friend Here_s a look at how an improbable idea promoted on the internet has become 	AGAINST	Jan 20, 2018 ... YouTube and Facebook said they will remove material showing people who  have ... Eating a Tide POD is a BAD IDEA, and we asked our friend ... Here's a  look at how an improbable idea promoted on the internet has become ...	19	0_google_3
4	tide	Feb 5 2018 Why are people eating Tide Pods Ingestion can lead to burns to the skin eyes and even to the Are people really eating Tide Pods 	FAVOR	Feb 5, 2018 ... Why are people eating Tide Pods? ... Ingestion can lead to burns to the skin, eyes  and even to the ... Are people really eating Tide Pods?	19	0_google_4
5	tide	Jan 17 2018 Principal can you talk to the kids about Tide Pods How is it 2018 and we have to warn people to not eat laundry detergent OK here goes 	AGAINST	Jan 17, 2018 ... Principal: can you talk to the kids about Tide Pods? ... How is it 2018 and we  have to warn people to not eat laundry detergent? OK, here goes.	19	0_google_5
6	tide	Jan 19 2018 However people have seemingly been doing just that biting into Tide Pods and posting videos of themselves doing it As a result there have 	FAVOR	Jan 19, 2018 ... However, people have seemingly been doing just that: biting into Tide Pods and  posting videos of themselves doing it. As a result, there have ...	19	0_google_6
7	tide	Jan 19 2018 Why people are mostly joking about eating Tide Pods These pods Tide seems to promise can revolutionize the way we wash life_s 	FAVOR	Jan 19, 2018 ... Why people are (mostly) joking about eating Tide Pods. ... These pods, Tide  seems to promise, can revolutionize the way we wash life's ...	19	0_google_7
8	tide	r SmallYoutubers is a place where youtubers who think they don_t have the views subscribers they deserve post their videos here to be seen by people like you 	FAVOR	r/SmallYoutubers is a place where youtubers who think they don't have the views/ subscribers they deserve post their videos here to be seen by people like you.	19	0_google_8
9	tide	I EAT TIDE PODS 100 NOT CLICKBAIT to all people out there do not eat tide I only made this video for comedic purposes please don_t try or eat tide pods they If you didn_t make a video about tide pods are you really a small youtuber For the first part view here 0 	FAVOR	I EAT TIDE PODS 100% NOT CLICKBAIT (to all people out there do not eat tide  ... I only made this video for comedic purposes please don't try or eat tide pods  they ... If you didn't make a video about tide pods are you really a small youtuber?  .... For the first part, view here: https://www.youtube.com/watch?v=N-5ufEb9qB0.	19	0_google_9
10	tide	 on 2018 01 27 In Video I Didnt Eat Tide Pods Tide pod challenge this isn_t clickbait If you didn_t make a video about tide pods are you really a small youtuber NOT A CLICK BAIT Click here to subscribe TODAY WE DID A SPICY NOODLE TIDE POD CHALLENGE What is wrong with people today Don_t 	AGAINST	... on 2018-01-27 In Video. I Didnt Eat Tide Pods Tide pod challenge this isn't  clickbait!! If you didn't make a video about tide pods are you really a small  youtuber? ... NOT A CLICK BAIT!!🤪 Click here to subscribe! ... TODAY WE DID A  SPICY NOODLE TIDE POD CHALLENGE!! ... What is wrong with people today!!? ?!! Don't ...	19	0_google_10
11	tide	 you didn_t already know that the tide pods meme was started by autistic people So the reason you don_t want to eat soap is because you_re neither autistic or If you believe I did or it reads like I did I apologize for that I_m a small YouTuber I have tried here to answer you calmly and respectfully and part of that 	AGAINST	... you didn't already know, that the tide pods meme was started by autistic people , ... So the reason you don't want to eat soap is because you're neither autistic or  ... If you believe I did, or it reads like I did, I apologize for that. ... I'm a small  YouTuber. ... I have tried here to answer you calmly and respectfully, and part of  that ...	19	0_google_11
12	tide	New York democrats introduce bill that require Tide Pods to look less It is not clear why Simontas believes that making Tide Pods monocrhromatic will make them When in 2012 Tide Pods launched these jokes about people eating them A small YouTuber realized that there was an opportunity to capitalize on this 	AGAINST	New York democrats introduce bill that require Tide Pods to look less ... It is not  clear why Simontas believes that making Tide Pods monocrhromatic will make  them ..... When in 2012 Tide Pods launched, these jokes about people eating  them ... A small YouTuber realized that there was an opportunity to capitalize on  this ...	19	0_google_12
13	tide	TIDE POD CHALLENGE TidePodChallenge VlogGrrr OR YOU CAN JOINING THE SMALL YOUTUBER ARMY and ADPOCALYPSE CHALLENGE 	AGAINST	TIDE POD CHALLENGE #TidePodChallenge | VlogGrrr ... OR YOU CAN *** ...  JOINING THE SMALL YOUTUBER ARMY and ADPOCALYPSE CHALLENGE!!	19	0_google_13
14	tide	 AND RT_s LOVED tidepods spaghet spaghetti TidePod tide smallyoutuber HERE WHY ARE PEOPLE EATING TIDE PODS 	AGAINST	... AND RT's LOVED ❤ @Demented_RTs #tidepods #spaghet #spaghetti # TidePod #tide #smallyoutuber HERE ... WHY ARE PEOPLE EATING TIDE PODS ??	19	0_google_14
15	tide	Based on the fact that kids are eating tide pods now I think this commercial needs a re run To celebrate here_s some stuff that didn_t make the original cut How It Feels to be a Small YouTuber Now How do we let it get this bad for our fellow human beings Even the non greased poles are taking people out in Philly 	AGAINST	Based on the fact that kids are eating tide pods now, I think this commercial  needs a re-run. ... To celebrate, here's some stuff that didn't make the original cut.  ... How It Feels to be a Small YouTuber Now ... How do we let it get this bad for  our fellow human beings? ... Even the non-greased poles are taking people out  in Philly.	19	0_google_15
16	tide	Thanks so much to Bubba Blue for tagging me in this do I amswer all the questions or did I just leave you with more questions hmmm Check out Bubba Be Silly Small YouTuber Tag Response Check out Bubba Blue and subscribe here Dont Eat The Tide Pods ft Chris J Asher Music Video Duration 3 35 	AGAINST	Thanks so much to Bubba Blue for tagging me in this, do I amswer all the  questions...or did I just leave you with more questions...hmmm Check out Bubba  ... Be Silly | Small YouTuber Tag Response ... Check out Bubba Blue and  subscribe here: ... Dont Eat The Tide Pods | ft Chris J Asher | (Music Video) -  Duration: 3:35.	19	0_google_16
17	tide	Drinking Bleach and eating Tide Pods is a sarcastic meme Did you know I put a shout out at the end of my videos SmallYoutubers Make People or houses or storylines I have no idea what you are doing here but you make it fun 	FAVOR	Drinking Bleach and eating Tide Pods is a sarcastic meme. ... Did you know I put  a shout out at the end of my videos? ... #SmallYoutubers ... Make People or  houses or storylines? ... I have no idea what you are doing here but you make it  fun.	19	0_google_17
18	tide	 as a small YouTuber like myself this is a pretty big deal and it means people are t shirt and contemplating how I can make my YouTube channel more popular of my lovely parody PSA videos of why you people shouldnt eat Tide Pods YouTubers trying to save YouTube from videos featuring dead bodies here is a 	AGAINST	... as a small YouTuber like myself this is a pretty big deal and it means people  are ... t shirt and contemplating how I can make my YouTube channel more  popular ... of my lovely parody PSA videos of why you people shouldnt eat Tide  Pods! ... YouTubers trying to save YouTube from videos featuring dead bodies  here is a ...	19	0_google_18
19	tide	I did however have permission to use everyone_s videos except Jinx of course What It_s Actually Like Being A Small YouTuber YouTube Commentary feel guilty making money off other people_s opinions and content that I used is no negative affect to it like encouraging your followers to eat Tide Pods for example 	FAVOR	I did however have permission to use everyone's videos except Jinx of course. ...  What It's Actually Like Being A Small YouTuber | YouTube Commentary ... feel  guilty making money off other people's opinions and content that I used. ... is no  negative affect to it like encouraging your followers to eat Tide Pods for example.	19	0_google_19
20	tide	Poison control help and safety tips to protect your children from poisoning if your child drank bleach bit a laundry pod ate fabric softener or was eed to A few can cause burns or even death such as rust remover and laundry pods Here is a run down of common laundry products and why they should be stored 	AGAINST	Poison control help and safety tips to protect your children from poisoning. ... if  your child drank bleach, bit a laundry pod, ate fabric softener, or was exposed to  ... A few can cause burns or even death, such as rust remover and laundry pods.  ... Here is a run-down of common laundry products - and why they should be  stored ...	14	1_google_1
21	tide	Jan 11 2018 Within three months U S poison centers reported more than 300 calls on pods some way or other and in August of that year a baby died after eating one The clearer it became that children were drawn to detergent pods candy sized A decade later drinking bleach was a punchline for anyone 	AGAINST	Jan 11, 2018 ... Within three months, U.S. poison centers reported more than 300 calls on… ...  pods some way or other, and in August of that year, a baby died after eating one.  ... The clearer it became that children were drawn to detergent pods — candy- sized, ... A decade later, drinking bleach was a punchline for anyone ...	14	1_google_2
22	tide	 2019 apprenticeship 2020 appriciate 2021 apprise 2022 apprised 2023 2579 atcha 2580 atchison 2581 atco 2582 atcp 2583 atcs 2584 ate 2585 atel 2586 11195 detergent 11196 deteriorate 11197 deteriorated 11198 deteriorating 12478 drinker 12479 drinkin 12480 drinking 12481 drinks 12482 drip 12483 	NONE	... 2019 apprenticeship 2020 appriciate 2021 apprise 2022 apprised 2023 ....  2579 atcha 2580 atchison 2581 atco 2582 atcp 2583 atcs 2584 ate 2585 atel  2586 ...... 11195 detergent 11196 deteriorate 11197 deteriorated 11198  deteriorating .... 12478 drinker 12479 drinkin 12480 drinking 12481 drinks 12482  drip 12483 ...	14	1_google_3
23	tide	21414218 18395825 the 17071656 i 16653578 15874397 to 13866327 yourself 134221 move 133800 boys 133725 yu 133654 eating 133429 point running 117289 others 117272 starting 116977 drink 116730 everybody hicks 2024 banners 2024 attire 2023 wd 2023 unforgettable 2023 nos 2022 	NONE	21414218 <@mention> 18395825 the 17071656 i 16653578 , 15874397 to  13866327 .... yourself 134221 move 133800 boys 133725 yu 133654 eating  133429 point ... running 117289 others 117272 starting 116977 drink 116730  everybody ...... hicks 2024 banners 2024 attire 2023 wd 2023 unforgettable 2023  nos 2022 ...	14	1_google_4
24	tide	the of to and in a _s for that on is was said with he as it by at from his __ `` an striking bulgaria sovereignty oxford elderly copy pipeline critic eating destroy 20 year 7 000 drinks contracted harassment 1940s graduation airplane joke schumacher intentions ordering reveals inventories poised tide knock lacked 	AGAINST	"the , . of to and in a "" 's for - that on is was said with he as it by at ( ) from his '' `` an  ..... striking bulgaria sovereignty oxford elderly copy pipeline critic eating destroy  .... 20-year 7,000 drinks contracted harassment 1940s graduation airplane joke ...  schumacher intentions ordering reveals inventories poised tide knock lacked ..."	14	1_google_5
25	tide	 Cf Cf_s Ch_in Chablis Chablis_s Chad Chad_s Chadwick Chagall Chaitanya Ticonderoga Tide Tide_s Tienanmen Tienanmen_s Tientsin Tientsin_s Tiffany Tigris at atavism atavism_s atavistic ate atelier atelier_s ateliers atheism atheism_s drink drink_s drinkable drinker drinker_s drinkers drinking drinkings drinks drip 	FAVOR	... Cf Cf's Ch'in Chablis Chablis's Chad Chad's Chadwick Chagall Chaitanya ......  Ticonderoga Tide Tide's Tienanmen Tienanmen's Tientsin Tientsin's Tiffany  Tigris ..... at atavism atavism's atavistic ate atelier atelier's ateliers atheism  atheism's ...... drink drink's drinkable drinker drinker's drinkers drinking drinkings  drinks drip ...	14	1_google_6
26	tide	8061 schools you 22484400 i 19975318 the 17594291 to 13200962 a 11230036 it 38293 lt 38235 glass 38193 eating 37867 tree 37829 bear 37762 stuck 37681 colonel yo 35020 moon 35015 turns 34869 mate 34866 drinking 34835 grand 2024 runnin 2024 peep 2023 wager 2022 drummer 2022 initially 2021 	NONE	8061 schools ... you 22484400 i 19975318 the 17594291 to 13200962 a 11230036 it .... 38293 lt  38235 glass 38193 eating 37867 tree 37829 bear 37762 stuck 37681 colonel ...  yo 35020 moon 35015 turns 34869 mate 34866 drinking 34835 grand ...... 2024  runnin 2024 peep 2023 wager 2022 drummer 2022 initially 2021 ...	14	1_google_7
27	tide	 2019 antics 2020 antidemocratic 2021 antidepressants 2022 antidote 2023 2928 atc 2929 atcha 2930 ate 2931 atention 2932 ates 2933 atewater 2934 atf 2935 deter 13631 deterent 13632 detergent 13633 deteriorate 13634 deteriorated 15479 drink 15480 drinker 15481 drinkers 15482 drinkin 15483 drinking 	AGAINST	... 2019 antics 2020 antidemocratic 2021 antidepressants 2022 antidote 2023 ....  2928 atc 2929 atcha 2930 ate 2931 atention 2932 ates 2933 atewater 2934 atf  2935 ...... deter 13631 deterent 13632 detergent 13633 deteriorate 13634  deteriorated ..... 15479 drink 15480 drinker 15481 drinkers 15482 drinkin 15483  drinking ...	14	1_google_8
28	tide	More than 27 million people use GitHub to discover fork and contribute to over 66 drink 67 small 68 medium 69 sachin 70 tendulkar 71 cricket 72 cup 653 runs 654 marathon 655 nino 656 brown 657 eating 658 chocolate 2020 excellent 5032 tide 5033 scepticism 5034 sweeps 5035 hurry 5036 owner 	AGAINST	More than 27 million people use GitHub to discover, fork, and contribute to over ...  66 drink. 67 small. 68 medium. 69 sachin. 70 tendulkar. 71 cricket. 72 cup .... 653  runs. 654 marathon. 655 nino. 656 brown. 657 eating. 658 chocolate ..... 2020  excellent ...... 5032 tide. 5033 scepticism. 5034 sweeps. 5035 hurry. 5036 owner.	14	1_google_9
29	tide	 Christine_s Christmas Christmas_s Christmases Christmastide Christmastide_s ataxic ate atelier atelier_s ateliers atheism atheism_s atheist atheist_s atheistic drink drinkable drinker drinker_s drinkers drinking drinks drip dripped drippier e2015 e2016 e2017 e2018 e2019 e2020 e2021 e2022 e2023 e2024 e2025 	FAVOR	... Christine's Christmas Christmas's Christmases Christmastide Christmastide's  ...... ataxic ate atelier atelier's ateliers atheism atheism's atheist atheist's atheistic  ...... drink drinkable drinker drinker's drinkers drinking drinks drip dripped drippier  ...... |e2015|e2016|e2017|e2018|e2019|e2020|e2021|e2022|e2023|e2024|e2025 | ...	14	1_google_10
30	tide	 S S UNK the to of and a in _s that for on is The was with said as at it by treat fighters D C computers involvement economies shape eating flow Eric sessions offshore toxic subprime Click eager versus Jamie drinks authorized preparations hill ounce Call Sanford conclusions IAEA Parents tide Thatcher 	FAVOR	"</S> <S> <UNK> the , . to of and a in "" 's that for on is The was with said as at it by  ..... treat fighters D.C. computers involvement economies shape eating flow Eric  .... sessions offshore toxic subprime Click eager versus Jamie drinks authorized  ..... preparations hill ounce Call Sanford conclusions IAEA Parents tide Thatcher ..."	14	1_google_11
31	tide	5844 upward 5845 up to date 5846 upcoming 5847 upfront 5848 upkeep 5849 9406 pock 9407 poca 9408 poco 9409 pocus 9410 podcast 9411 pods 9412 dokie 11714 drink 11715 drift 11716 drip 11717 drill 11718 draw 11719 drag tire 12494 tiring 12495 tidbit 12496 tide 12497 tidy 12498 tidal 12499 tidings 	FAVOR	5844 upward 5845 up-to-date 5846 upcoming 5847 upfront 5848 upkeep 5849  ..... 9406 pock 9407 poca 9408 poco 9409 pocus 9410 podcast 9411 pods 9412  ..... dokie 11714 drink 11715 drift 11716 drip 11717 drill 11718 draw 11719 drag  .... tire 12494 tiring 12495 tidbit 12496 tide 12497 tidy 12498 tidal 12499 tidings ...	14	1_google_12
32	tide	dict in quicksearch located at src 2010 2011 2012 2013 2014 2015 2016 2017 2018 2019 2020 2021 2022 2023 2024 2025 Ticonderoga Tide Tienanmen Tiffany Tigris Tijuana Tillich Tillman Tilsit Tim Timbuktu Timex drift drifter driftnet driftwood drill driller drillmaster drink drinkable drinker drip dripped dripping 	AGAINST	dict in quicksearch located at /src. ... 2010 2011 2012 2013 2014 2015 2016  2017 2018 2019 2020 2021 2022 2023 2024 2025 ...... Ticonderoga Tide  Tienanmen Tiffany Tigris Tijuana Tillich Tillman Tilsit Tim Timbuktu Timex ...... drift  drifter driftnet driftwood drill driller drillmaster drink drinkable drinker drip dripped  dripping ...	14	1_google_13
33	tide	 Dream gum Dream stick Dreamer Dreams Dreck Drink Dropper Drowsy high Dry Dyno pure Earth Easing powder Eastside player Easy score Eating Ecstasy Egg Pit Pixies Plant Pocket rocket Pod Poison Poke Polvo Polvo blanco Polvo de pc2017 pc2018 pc2019 pc2020 pc2021 pc2022 pc2023 pc2024 pc2025 	NONE	... Dream gum Dream stick Dreamer Dreams Dreck Drink Dropper Drowsy high  Dry ... Dyno-pure Earth Easing powder Eastside player Easy score Eating  Ecstasy Egg .... Pit Pixies Plant Pocket rocket Pod Poison Poke Polvo Polvo  blanco Polvo de ...... pc2017 pc2018 pc2019 pc2020 pc2021 pc2022 pc2023  pc2024 pc2025 ...	14	1_google_14
34	tide	Jan 12 2018 The latest Tide Pod Challenge is just as ridiculous as it sounds detergent bombs actually do in a weird way look good enough to eat 	AGAINST	"Jan 12, 2018 ... The latest ""Tide Pod Challenge"" is just as ridiculous as it sounds. ... detergent  bombs actually do, in a weird way, look good enough to eat."	6	2_google_1
35	tide	Buy Tide PODS Liquid Laundry Detergent Pacs Ocean Mist 72 loads at Walmart com Shop All FoodCoffeeBeveragesSnacksBreakfast to help keep your familys clothes smelling as great as they look Keep out of reach of children pair of pj pants he can_t wear either one now when you try to put it off it rips a hole 	AGAINST	Buy Tide PODS Liquid Laundry Detergent Pacs, Ocean Mist, 72 loads at Walmart .com. ... Shop All FoodCoffeeBeveragesSnacksBreakfast ..... to help keep your  familys clothes smelling as great as they look; Keep out of reach of children ....  pair of pj pants he can't wear either one now.... when you try to put it off it rips a  hole...	6	2_google_2
36	tide	Tide PODS Plus Febreze Sport Odor Defense Laundry Pacs Active Fresh Scent 12 count Designed For Regular and HE Washers Average rating 4 7424out 	AGAINST	Tide PODS Plus Febreze Sport Odor Defense Laundry Pacs, Active Fresh Scent,  12 count, Designed For Regular and HE Washers. Average rating:4.7424out ...	6	2_google_3
37	tide	Feb 5 2018 This question was originally answered on Quora by Emmad Mazhari How did Tide Pod eating go viral originally appeared on Quora the place to gain and share Tide Pods look like candy delicious candy at that The bright colors shapes texture and weight all resemble that of a _bite sized_ snack 	AGAINST	Feb 5, 2018 ... This question was originally answered on Quora by Emmad Mazhari. ... How did  Tide Pod eating go viral? originally appeared on Quora: the place to gain and  share ... Tide Pods look like candy (delicious candy at that). The bright colors,  shapes, texture and weight all resemble that of a 'bite-sized' snack.	6	2_google_4
38	tide	Jan 19 2018 Why people are mostly joking about eating Tide Pods These pods Tide seems to promise can revolutionize the way we wash life_s indignities out of our clothes eating Tide pods but now I been thinking about how weird it is for so the fruit snack brand Gushers to request a safe Tide Pod like candy 	FAVOR	Jan 19, 2018 ... Why people are (mostly) joking about eating Tide Pods. ... These pods, Tide  seems to promise, can revolutionize the way we wash life's indignities out of our  clothes. ... eating Tide pods but now I been thinking about how weird it is for so ...  the fruit snack brand Gushers to request a safe, Tide Pod-like candy.	6	2_google_5
39	tide		NONE		6	2_google_6
40	tide	Jan 2 2018 Just so that there is NO confusion Buzzfeed reached out to Tide who reiterated people should only use Tide pods to do laundry In other words 	AGAINST	Jan 2, 2018 ... Just so that there is NO confusion, Buzzfeed reached out to Tide who reiterated  people should only use Tide pods to do laundry. In other words ...	20	3_google_1
41	tide	Jan 17 2018 Health Eerts Issue Warnings About the Potentially Deadly _Tide Pod better than to eat the soap filled pod but decided to do it on a dare 	AGAINST	Jan 17, 2018 ... Health Experts Issue Warnings About the Potentially Deadly 'Tide Pod .... better  than to eat the soap-filled pod, but decided to do it on a dare.	20	3_google_2
42	tide	In news that will seriously make you question humanity stores across the US have y_all really joked around so much that tide put their tide pods in plastic to ingest the pods with Tide themselves forced to release several warnings But her biggest problem at the moment Has Contouring Officially Gone Too Far 	AGAINST	In news that will seriously make you question humanity, stores across the US  have ... y'all really joked around so much that tide put their tide pods in plastic ...  to ingest the pods, with Tide themselves forced to release several warnings ... But  her biggest problem at the moment? ... Has Contouring Officially Gone Too Far?	20	3_google_3
43	tide	1 hour agoThis is an official account Australia abc net au place for large surf and 	AGAINST	1 hour agoThis is an official @ABCaustralia account. Australia. abc.net.au/ .... place for large surf and ...	20	3_google_4
44	tide	Jan 17 2018 The Tide Pod Challenge reportedly has teenagers eating laundry pods of intentional misuse of these pods among teenagers in all of 2016 and 53 in 2017 that while the problem may not be hugely common it is on the rise The USCPSC has been warning parents about laundry pods since 2013 	AGAINST	Jan 17, 2018 ... The Tide Pod Challenge reportedly has teenagers eating laundry pods. ... of  intentional misuse of these pods among teenagers in all of 2016, and 53 in 2017,  ... that while the problem may not be hugely common, it is on the rise. ... (The  USCPSC has been warning parents about laundry pods since 2013.) ...	20	3_google_5
45	tide	Jan 24 2018 Tide_s official Twitter account has joined the parent company and the U S government in warning consumers not to partake elicitly saying consumption of Tide Pods is 600 loads of laundry every year and the suggested retail price per pod being 25 cents You can follow her on Twitter 	AGAINST	Jan 24, 2018 ... Tide's official Twitter account has joined the parent company, and the U.S.  government, in warning consumers not to partake, explicitly saying consumption  of Tide Pods is ... 600 loads of laundry every year, and the suggested retail price  per pod being 25 cents, ... You can follow her on Twitter @malito_ali.	20	3_google_6
46	tide	Tile pod Chan Do at y lushsux Following lushsux Tide pod related wall a video featuring NFL star Rob Gronk Gronkowski warning people not to eat them locking Tide PODS up requiring a store employee to retrieve them for customers in the Tide Pod Challenge the official Tide Twitter account has assumed the 	FAVOR	"Tile pod Chan Do at y lushsux Following lushsux Tide pod related wall? ... a  video featuring NFL star Rob ""Gronk"" Gronkowski warning people not to eat them . ... locking Tide PODS up, requiring a store employee to retrieve them for  customers. ... in the Tide Pod Challenge, the official Tide Twitter account has  assumed the ..."	20	3_google_7
47	tide	Feb 5 2018Your browser does not currently recognize any of the video formats but I think we can all 	AGAINST	Feb 5, 2018Your browser does not currently recognize any of the video formats ... but I think we can all ...	20	3_google_8
48	tide	All non permitted personal items such as beach chairs umbrellas tents ice chests and beach toys are The absence of beach warning flags does not constitute safe swimming conditions For current surf conditions call 251 968 TIDE 8433 	AGAINST	All non-permitted personal items such as beach chairs, umbrellas, tents, ice  chests and beach toys are ... The absence of beach warning flags does not  constitute safe swimming conditions. For current surf conditions call 251-968- TIDE (8433).	20	3_google_9
